lemma,sentence,sense,start,end
,অনেক সময় অবশ্য বাচ্চা বাড়ি চলে যাওয়ার পর এই জন্ডিস ধরা পড়ে ।,,,
,যাদের জন্য শবে বরাতের ইবাদাত নিষ্ফল তা তুলে ধরা হলো -,,,
,বইটিতে বিশ্বের বিভিন্ন দেশের মোট জন জলবায়ু সংগ্রামীর কথা তুলে ধরা হয়েছে ।,,,
,"এমন বৃষ্টিদিনেও রাস্তায় লোক কম নেই , আপিস ফেরতা সব নারী-পুরুষেরা গোটানো প্যান্ট আর হাঁটুর উপর তুলে ধরা শাড়ি নিয়ে দৌঁড়ান বাসের পেছনে পেছনে ।",,,
,যা অনেক সময় ধরা পড়েনা ।,,,
,"প্রশাসনিক এবং পরিসংখ্যানগত উদ্দেশ্যে মৎস্যজীবী যেমন মা জাহাজ টাইপ নিচু জাল , সমুদ্রের তল মাছের মাছ ধরার মাছ ( উত্তর তল্লা , রূপান্তর ট্রল , উত্তর জাহাজ , দক্ষিণ ট্রল , চিংড়ি ট্রল ) , ওয়েস্ট নেট মাছ ধরার শিল্প ( ট্র্যাবল , নিচু নেট ) মা জাহাজ উত্তর প্রশান্ত মহাসাগর তুষারপাত ইত্যাদি ফিশারী , উত্তর সাগর হর্চা / সাইন নেট মাছ ধরার , মহাসাগর নিলামে মাছ ধরার মাছ ধরা , মহাসাগর টুনা ফিশিং মৎস্য , পুকুরের বীজ মাছ চাষের শিল্প , নিউজিল্যান্ড জলবায়ু ইত্যাদি ।",,,
,প্রতিদিনের পরিবর্তন বা গতির ছন্দ – সব ধরা পড়ে আমাদের চোখে ।,,,
,হিসাব ও সাধারণ জ্ঞান : ধরা যাক তৃতীয় ধাপ থেকে প্রথম সদস্য কমিশন পেতে থাকলো এবং সপ্তম ধাপে তার ক্রয়কৃত পণ্যটির মূল্য সম্পুর্ণ ফেরত পেল ।,,,
,কাজেই তার সামনে একটাই পথ খোলা থাকে - অস্পষ্ট কোনো রূপ ধরা ।,,,
,এ পর্যায়ে সবার জন্য তুলে ধরলাম মাছ ধরার বিশেষ একটি যন্ত্রকে ।,,,
,চুরির সাথে জড়িত অন্যদেরও ধরার চেষ্টা অব্যাহত রয়েছে ।,,,
,প্রধানমন্ত্রীর কাছে উনার তুলে ধরার কথা ছিল করোনা মোকাবেলায় কী কী লাগবে সেগুলো তুলে ধরা ।,,,
,বাংলালিংকের পয়সা অফারে রেজিঃ করতে গিয়া ধরা খাইছি ।,,,
,"শুনলে হাসি পায় যে , গিগা বাইটের হার্ডড্রাইভকে এক সময় বিশাল মেমরির অধিকারী ধরা হত !",,,
,বিভিন্ন দেশের হালনাগাদ তথ্যের ভিত্তিতে সরকার প্রধানদের বেতন তুলে ধরেছে ইকোনমিক টাইমস । ওই প্রতিবেদন অনুযায়ী বিশ্বের টি দেশের রাষ্ট্রপ্রধানের বেতন তুলে ধরা হলো ।,,,
,এ চালু হওয়া উত্তর আমেরিকান গ্র্যাপলিং সমিতি উত্তর আমেরিকা ও ইউরোপ জুড়ে নতি আঁকড়ে ধরা গ্র্যাপলিং এবং ব্রাজিলিয়ান জু-জিতসু টুর্নামেন্ট আয়োজন করে ।,,,
,গত শুক্রবার দেশটির রাজধানী বেইজিংয়ে শুরু হওয়া ন্যাশনাল পিপলস কংগ্রেসের বার্ষিক সম্মেলনে পরিকল্পনাটি তুলে ধরা হয় ।,,,
,"মেলা কমিটির সম্পাদক হেরম্ব কুমার দাস জানান , দিন ব্যাপী এই মেলার বাজেট ধরা হয়েছে প্রায় লক্ষ টাকা ।",,,
,এই লক্ষণগুলো ধরা পড়তে থেকে দিন পর্যন্ত সময় লাগে ।,,,
,ধরা যাক আপনি আঞ্চলিক ভাষায় এক ছোটো সংবাদমাধ্যম শুরু করলেন । তাতে বড় সংবাদপত্রগুলি যে ভাবে ঘটনা উপস্থাপনা করে তার চেয়ে ভিন্নভাবে করতে চান ।,,,
,কাছেই থাকা সিসিটিভি ক্যামেরায় পুর ঘটনা ধরা পড়ে,,,
,বা বছরকে একটি প্রজন্মের মেয়াদ ধরা হয় ।,,,
,ধৃতদের কারও মধ্যেই অসুস্থতার লক্ষণ ধরা পড়েনি ।,,,
,রাতের হাওর এলাকায় ডিঙি নৌকাগুলোর ভরপানিতে কুপিবাতি জ্বালিয়ে মাছ ধরার দৃশ্য কিংবা চাঁদের আলোয় আলোকিত চঞ্চল ঢেউগুলোর চিকমিক করা হৃদয়কাড়া সৌন্দর্য যেকারো স্মৃতিপটে দাগ কাটবে ।,,,
,মঙ্গলবার সকালে আসানসোলের দুটি পৃথক জায়গা থেকে বিজয় কুমার ও রঞ্জিত সিংহ নামে ওই দুই প্রতারককে ধরা হয় ।,,,
,"যুক্তরাষ্ট্র , রাশিয়া , ভারত , যুক্তরাজ্য , জার্মানি এমন কোনো পরাশক্তির দেশ বাকি নেই যে , তাদের পতাকা খামচে ধরার হুমকি দেয়নি ডায়েস ( আইএসের পশ্চিমা নাম ) ।",,,
,অন্তত পাঠকের কাছে ফেনিল সাগরের দৃশ্যকল্পের কামনার জটিল টালমাটাল অবস্থা তুলে ধরা স্পষ্ট যৌন দ্যোতনা রয়েছে ।,,,
,"র্যালির আয়োজক কমিটির চেয়ারম্যান তম ইসলামি ঐক্যর ব্যাপারে বলেন , এ র ‍ যালির মূল উদ্দেশ্য মুসলিদের সাফল্যের উপর জোর দেওয়া এবং মুসলমানদের মধ্যে বিদ্যমান প্রাণবন্ত সংস্কৃতিসমূহ সকলের সম্মুখে তুলে ধরা ।",,,
,ধরা যাক জ্যামের কথা ।,,,
,"রাজধানীর গুলশানে রেস্তোরাঁয় অভিযানে ছয় জঙ্গি মারা গেছে এবং তাদের একজন আইনশৃঙ্খলা বাহিনীর হাতে ধরা পড়েছে বলে জানিয়ে প্রধানমন্ত্রী বলেন , ' অপারেশন সফল হয়েছে , কমান্ডো অপারেশনে জনকে বাঁচাতে পেরেছি ।",,,
,সালের জুলাই গোপালগঞ্জের কোটালীপাড়ায় শেখ লুৎফর রহমান আদর্শ কলেজের মাঠে প্রধানমন্ত্রী শেখ হাসিনার সমাবেশস্থলের পাশে কেজি ওজনের বোমা পুঁতে রাখার ঘটনা ধরা পড়ে ।,,,
,"কিন্তু রোববার ঘিরে ধরা শ্রমিকরা বললেন , এমন কোনো সহায়তার নাম-গন্ধও তারা পাননি ।",,,
,ঢাকার পরিবারের সাথে যোগাযোগ করতে গিয়েই সে চিহ্নিত হয় এবং ধরা পড়ে ।,,,
,শেষ পর্যন্ত কাউন্টার টেররিজম অ্যান্ড ট্রান্সন্যাশনাল ক্রাইম ইউনিটের জালে ধরা দিতে হয়েছে একাধিক পৈশাচিক খুনের এ অপনায়ককে ।,,,
,আপেনরডাই ধরাই তইলে ।,,,
,গ্রামের বিভিন্ন বয়সী মানুষ দিনক্ষণ ঠিক করে মাছ ধরার উৎসবে মেতে উঠতো ।,,,
,"সরকার একদিকে জঙ্গী ধরার নামে সারা দেশে সাঁড়াশী অভিযান চালিয়ে প্রতিদিন হাজার হাজার লোককে অন্যায়ভাবে গ্রেফতার করে দেশের জনগণকে উদ্বেগ , উৎকণ্ঠ ও আতংকের মধ্যে রাখছে ।",,,
,ব্যর্থতার অনুমান নির্ভর পরিসংখ্যান তুলে ধরার আগে চলুন একবার স্মরণ করে আসা যাক সাফল্যের স্মৃতি ।,,,
,"শনিবার রাতে রাজ্যের স্বাস্থ্য দফতর জানিয়েছে , গত ঘণ্টায় হাজার জনের মধ্যে নতুন করে সংক্রমণ ধরা পড়েছে ।",,,
,"বেনারকে তিনি বলেন , "" ইয়াবার কারবার থেকে স্থানীয় ব্যবসায়ীরা নিজেদের গুটিয়ে নেওয়ায় এখন রোহিঙ্গারাই বেশি ধরা পড়ছে বা মারা যাচ্ছে । """,,,
,বেতন খাতে কর্মকর্তাদের জন্য লাখ হাজার টাকা ; কর্মচারীদের জন্য লাখ হাজার টাকা ; কর্মকর্তা-কর্মচারীদের ভাতা বাবদ লাখ হাজার টাকা ; টিএ / ডিএ ও ওভারটাইম বাবদ পাঁচ লাখ টাকা এবং শ্রমিকদের মজুরি বাবদ ব্যয় ধরা হয়েছে লাখ হাজার টাকা ।,,,
,- এর শিক্ষাপদ্ধতির কিছু দিক তুলে ধরা হলো -,,,
,মাদরাসাগুলোতে পাঠানোর উদ্দেশ্য নির্দেশনায় অনলাইনে নবম শ্রেণির শিক্ষার্থীদের রেজিস্ট্রেশন ফরম পূরণের বিস্তারিত প্রক্রিয়া তুলে ধরা হয়েছে ।,,,
,এর পরে মনিকাকে চেপে ধরা হলে সে ওই দুর্ঘটনার কথা স্বীকার করে বলে জানিয়েছেন সুভাষবাবু ।,,,
,"এমন এক যুগলের কথা ধরা যাক , যেখানে সঙ্গিনীর সামান্য শারীরিক সমস্যা – এই যেমন : ঠাণ্ডা লেগে সর্দি-কাশি হয়েছে ।",,,
,এ দিন অনুমোদিত ফেনী আলোকদিয়া-ভালুকিয়া-লস্করহাট-ছাগলনাইয়া জেলা মহাসড়কটি যথাযথ মান ও প্রশস্ততায় উন্নীতকরণ প্রকল্পের ব্যয় ধরা হয়েছে কোটি লাখ টাকা ।,,,
,পুরোহিতের ফুল ধরা হাত টেনে আবার নাকের কাছে নিয়ে এল ।,,,
,"তাতে বিধবা মেয়ে সোনার ঈশা খাঁর সঙ্গে পালিয়ে যাওয়া এবং তাকে উদ্ধার করতে আসা কাকার ফৌজের বিরুদ্ধে নিজের হাতে তলোয়ার ধরার খবর পেয়ে পতন , মূর্চ্ছা ও মৃত্যু ।",,,
,"একদিকে নকশাল রাজনীতির পোড় খাওয়া কমরেড , তার পাশেই আবার ভুয়া মুক্তিযোদ্ধার ঘর গুছিয়ে নেয়ার আয়োজন , আবার অন্যদিকে দেখি একেবারে হাল রাজনীতিতে ভুয়া গণতন্ত্র কায়েমের আত্মপ্রসাদ ; বাংলাদেশি রাজনীতির এইসব নখরাবাজি ক্ষমাহীন শ্লেষের ভাষায় তুলে ধরা হয়েছে ।",,,
,নারী নির্যাতনের প্রতিবাদের একটা ব্যাটন এখন তাঁরই হাতে ধরা ।,,,
,"তিনি জানান , ধৃতদের বাল্যবিবাহ প্রতিরোধ আইনে ধরা হয়েছে ।",,,
,( দুইমাস দিনের ও একমাস দিনের ধরা হলে ) মোটদিন + = - কে দ্বারা ভাগ করা হলে ভাজ্যটি নিঃশেষে বিভাজ্য হয় না ; বরং ভাগশেষ বাকি থাকে . ... ।,,,
,"নাসা জানায় , ' কেপলার স্পেস ' টেলিস্কোপে মোট টি নতুন গ্রহ ধরা পড়েছে ।",,,
,অথবা ধরা পড়ে বহিষ্কৃত হতে পারতাম ।,,,
,এছাড়া চলতি বছর পশ্চিমবঙ্গে তেমন ইলিশ ধরা পড়েনি ।,,,
,এবার বাজেটের আকার ধরা হয়েছে লাখ কোটি টাকা ।,,,
,"কয়েক জন ধরা পড়েছে , কয়েক জন পালিয়ে বেড়াচ্ছে ।",,,
,ভাল ছবি বঙ্গ রাজনীতির হিংসা-চিত্র দেখতে দেখতে অভ্যস্ত হয়ে যাওয়া চোখে ধরা পড়ল অন্য ছবি ।,,,
,মজনু ডাকাত গতকাল রাতে নুরু শেখের বাড়িতে ডাকাতি করতে গিয়ে ধরা পরে ।,,,
,বিরোধী দলকে বাগে রাখা গেলেও আওয়ামী লীগ এবং সহযোগী সংগঠনের লাগাম টেনে ধরা সম্ভব হচ্ছ না ।,,,
,অল্প বিদ্যা নিয়ে কন কাজ করতে গেলে তাতে ধরা খেতে হয় ।,,,
,তা হলো - সেপ্টেম্বর-অক্টোবর ইলিশ প্রজনন ও আহরণের ভরা মৌসুমে মাস ইলিশ ধরা বন্ধ রাখা হলে ইলিশ আহরণ / প্রাপ্তি অর্থ্যৎ উৎপাদন অনেক কমে যাবে ।,,,
,ক্ষমতার অপব্যবহারের অভিযোগে একটি মামলায় নিজের বাড়ি থেকেই ধরা হয়েছে তাঁকে ।,,,
,এখন খরচ ধরা হয়েছে হাজার কোটি টাকা ।,,,
,ছয়টি অধ্যায়ে রচিত এ গ্রন্থে জনসংযোগ পেশায় বিভিন্ন অভিজ্ঞতার পাশাপাশি জনসংযোগ সম্পর্কিত তত্ত্ব ও তথ্য তুলে ধরা হয়েছে ।,,,
,ধুমকেতুতে প্রকাশিত ' অনন্দময়ী আগমনের ' যে কবিতাটির জন্য কবির এক বছর সশ্রম কারাদন্ড হয়েছিল সেই কবিতাটির কিছু অংশ তুলে ধরা হল ।,,,
,তবে বৃহস্পতিবার বিকেল সাড়ে তিনটায় এ রিপোর্ট লেখা পর্যন্ত তাদের ছোট ভাই আলামিন ও তার বন্ধু অস্ত্র সরবরাহকারী শফিকুল ধরা পড়েনি ।,,,
,"ওই হত্যাকাণ্ডের সঙ্গে যারা জড়িত ছিল , তাদের অধিকাংশই ধরা পড়েছে বলে জানিয়ে সাংবাদিকদের স্বরাষ্ট্রমন্ত্রী বলেন , ' বাকিরা অচিরেই ধরা পড়বে , আপনারা নিশ্চিন্ত থাকেন । '",,,
,"আহমদ ছফার দৃষ্টিতে বাংলায় সাধারণ জনগণের ইসলাম ধর্মে কনভার্সনের এই দিকটা ধরা না পড়লেও তৎকালীন বাংলা , এবং সেই সাথে ভারতবর্ষে বৃটিশবিরোধী রাজনীতির ইতিহাস পর্যালোচনা করলে এটা সহজেই বোঝা যায় ।",,,
,এতদিন ধরে মুসল্লীরা ভুল কেবলায় নামায পড়ছেন । পরে কম্পাস নিয়ে পরীক্ষা করতে গিয়ে এই ভুল ধরা পরে । কয়েকদিন আগে এটি ধরা পরেছে । নামাযের লাইন গুলো এখন মসজিদের সঙ্গে কোনাকুনি অবস্থায় আছে ।,,,
,বানান ভুলসহ ধরা পড়ে নানা অসঙ্গতি ।,,,
,"এমপি আরও বলেন , ' সেতুটি নির্মাণে প্রাথমিকভাবে লাখ টাকা খরচ ধরা হয়েছে ।",,,
,"সোয়াদ তার স্ট্যাটাসে লেখেন , ' অনেকদিন ধরেই আমার কাছে ওই গলায় ছুরি ধরার ঘটনাটা জানতে চাওয়া হচ্ছে ।",,,
,বিষয়টি তাঁর নতুন বই ' দি অ্যাচিভমেন্ট হ্যাবিট ' - এ তুলে ধরা হয়েছে ।,,,
,"( আখতারুজ্জামান ইলিয়াস - চিলেকোঠার সেপাই , পৃ-১২১ ) পুরান ঢাকার খিস্তি খেউড় তুলে ধরা আখতারুজ্জামানের লেখনীর প্রধান বৈশিষ্ট্য ।",,,
,ক্লাস থ্রিতে উঠবো এমন সময় বাপের সঙ্গে নৌকায় মাছ ধরা শুরু করি ।,,,
,সমগ্র কাগায়ানে জাল পেতে রাখা হয়েছে আপনাকে ধরার জন্য ।,,,
,দিনভর নানা অনুষ্ঠান আয়োজনে ব্যয় ধরা হয়েছে দেড় লক্ষ টাকা ।,,,
,অনেক বলেও ওকে আমরা ঠিক করতে পারলাম না । এরপর কিছুদিন যেখানে সেখানে ওদেরকে পাওয়া গেল গল্পরত অবস্থায় । কিন্তু তার এই প্রেম বেশিদিন টিকল না । একদিন জুনিওরটার সাথে গল্প করতে গিয়ে ধরা পড়ল হাউস প্রিফেক্টের হাতে । হাউস প্রিফেক্ট ঐ জুনিওরটাকে দিয়ে ওর কান ধরিয়ে সারা হাউস ঘুরালেন । সেই সাথে প্রেমের ভূতটাও নেমে গেল ওর মাথা থেকে । কিন্তু সেই দিন থেকে ওর নাম হয়ে গেল মধূসুদন ।,,,
,বৃহস্পতিবার ( জানুয়ারি ) সকালে চীন থেকে আসা এই যাত্রীর অতিরিক্ত তাপমাত্রা ( জ্বর ) ধরা,,,
,"সে সময় কাউেক বেল দেত হয়না কতটা নর্ভরতায় , কতটা বিশ্বাসে এভােব আঁকেড় ধরা যায় ।",,,
,কিন্তু কোথাও একবার ডায়াগনোসিসে ধরা পড়ে না রোগ ।,,,
,মানিকগঞ্জের দৌলতপুর উপজেলায় জালভোট দেয়ার সময় এক সহকারী প্রিসাইডিং অফিসার হাতেনাতে ধরা পড়েছেন ।,,,
