lemma,sentence,sense,start,end
ধরা,"বিদ্যুৎ খাতের মহাপরিকল্পনা অনুযায়ী , সাল নাগাদ নবায়নযোগ্য জ্বালানি থেকে তিন হাজার মেগাওয়াট বিদ্যুৎ উৎপাদনের যে লক্ষ্য ধরা হয়েছে , শুল্ক আরোপের ফলে তাও বিঘ্নিত হওয়ার আশঙ্কা ছিল সবার ।",0,121,123
ধরা,কিন্তু এই পরিমাণ টাকা শুধু পিস্তল ও শটগানের মূল্য হিসেবে ধরা হয়নি ।,0,57,59
ধরা,উল্লেখ্য মুজিব শতবর্ষ উপলক্ষে প্রধানমন্ত্রীর একান্ত ইচ্ছায় সারা দেশের গৃহহীনদের জন্য আবাসন ব্যবস্থার অংশ হিসেবে ' ক ' শ্রেণির গৃহ নির্মাণ প্রকল্পের আওতায় প্রতিটি বাড়ি নির্মাণে ব্যায় ধরা হয়েছে লাখ হাজার টাকা ।,0,186,188
ধরা,"ইসলামিক ফাউন্ডেশন সূত্রে জানা গেছে , প্রধানমন্ত্রী শেখ হাসিনার অগ্রাধিকারভিত্তিক প্রকল্প হিসেবে ইসলামিক ফাউন্ডেশন ও ধর্মবিষয়ক মন্ত্রণালয়ের উদ্যোগে জেলা ও উপজেলা পর্যায়ে টি মডেল মসজিদ নির্মাণকাজ শুরু হয় , যার নির্মাণ ব্যয় ধরা হয় হাজার কোটি টাকা ।",0,116,118
ধরা,ওয়াইম্যাক্সকেও প্রি-ফোরজি ধরা হয় ।,0,27,29
ধরা,গ্রামে মাথাপিছু দৈনিক খরচ টাকা পয়সার নীচে হলেই ধরা হয় তিনি দারিদ্রসীমার নীচে বাস করছেন ।,0,48,50
ধরা,খুচরা পর্যায়ে প্যাকেট বা বোতলজাত প্রতি লিটার সয়াবিন তেলের নতুন দাম ধরা হয়েছে টাকা ।,0,69,71
ধরা,""" প্রবৃদ্ধির হার সর্বোচ্চ থেকে শতাংশ ধরা যেত ।",0,37,39
ধরা,এই প্রকল্পের ডিপিপিতে একটি লিটারের পানির প্লাস্টিকের একটি ড্রাম ( চাউলসহ ) ও সবজি কাটার একটি বঁটির দাম ধরা হয়েছে হাজার টাকা করে ।,0,103,105
ধরা,"এখন দেখছি অনেক খাতে যে খরচ ধরা হয়েছে , সেটা বেশি মনে হচ্ছে ।",0,27,29
ধরা,"উপজেলায় হাজার টি ষাঁড় , টি বলদ , টি ( এদো ) বকন গাভী গড় দাম ধরা হয়েছে কোটি লাখ হাজার টাকা ।",0,63,65
ধরা,বাকি চারটির কাজ পর্যায়ক্রমে ধরা হবে ।,0,29,31
ধরা,এছাড়া গতবছর হাজার হেক্টর জমিতে তুলা আবাদের লক্ষ্যমাত্রা ধরা হলেও সেখানে আবাদ হয়েছিলো হাজার হেক্টর জমিতে ।,0,57,59
ধরা,"এর মধ্যে স্ক্যানিংয়ের জন্য টাকা , ট্রানশিপমেন্ট বাবদ টাকা ও নথি প্রক্রিয়াকরণ বাবদ টাকাসহ আটটি খাতে এ টাকা ধরা হয় ।",0,108,110
ধরা,ধরা যাক % হারে ডিভিডেন্ড দেওয়া কোম্পানিটির শেয়ারের মার্কেট প্রাইস টাকা ।,0,0,2
ধরা,জানুয়ারি ও ফেব্রুয়ারিকে দিন ধরা হতো সে সময় ।,0,30,32
ধরা,টাইগারদের পৃষ্ঠপোষক স্বত্বের ভিত্তিমূল্য ধরা হয়েছে কোটি টাকা ।,0,41,43
ধরা,ব্রেসলেটটির ভিত্তিমূল্য ধরা হয় লাখ টাকা ।,0,24,26
ধরা,আগামী অর্থ বছরে বিভিন্ন খাত থেকে মোট আয় ধরা হয়েছে কোটি লক্ষ টাকা ।,0,41,43
ধরা,অকৃষি জমির মূল্য ধরা হয়েছে হাজার টাকা ।,0,17,19
ধরা,এতে মোট খরচে ধরা হয়েছে ছয় হাজার কোটি লাখ টাকা ।,0,13,15
ধরা,ব্যয় ধরা হয়েছিল লক্ষ হাজার টাকা ।,0,6,8
ধরা,"চায়ের ক্রমবর্ধমান অভ্যন্তরীণ চাহিদা পূরণ , রফতানি বৃদ্ধি বিষয়টি সামনে রেখে সালে দেশে মিলিয়ন কেজি চা উৎপাদনের লক্ষ্যমাত্রা ধরা হয়েছে । '",0,125,127
ধরা,প্রতিটির জন্য ব্যয় ধরা হয়েছে লক্ষ টাকা করে ।,0,20,22
ধরা,"জানা যায় , ইঞ্জিনকেনা প্রকল্পে মোট ব্যয় ধরা হয়েছে দশমিক কোটি টাকা ।",0,42,44
ধরা,"আর কোনো কোম্পানির পিই এর নিচে চলে গেলে , ওই কোম্পানির শেয়ার দাম অবমূল্যায়িত ধরা হয় ।",0,78,80
ধরা,ডিপিডিসির আওতাধীন এলাকায় আট লাখ পঞ্চাশ হাজার স্মার্ট প্রি-পেমেন্ট মিটার স্থাপন প্রকল্পের খরচ ধরা হয়েছে কোটি লাখ টাকা ।,0,94,96
ধরা,কৃষিতে এ বার বৃদ্ধির হার ধরা হয়েছে মাত্র . % ।,0,25,27
ধরা,অ্যাস কিকার নামের এই কফির দাম ধরা হয়েছে অস্ট্রেলীয় ডলার ।,0,30,32
ধরা,"লাখ হাজার ভোটের মধ্যে ধরা হচ্ছে , সর্বোচ্চ শতাংশ ভোট পড়তে পারে ।",0,22,24
ধরা,এই প্লান্ট তৈরির ব্যয় ধরা হয়েছে . বিলিয়ন ডলার ।,0,23,25
ধরা,এতে উৎপাদনের লক্ষ্যমাত্র ধরা হয়েছে লাখ হাজার শ মেট্রিক টন ধান ।,0,25,27
ধরা,লাইন-১ এর রুট ধরা হয়েছে বিমানবন্দর থেকে কমলাপুর স্টেশন এবং নতুন বাজার থেকে পূর্বাচল ডিপো পর্যন্ত ।,0,14,16
ধরা,তবে কালভার্ট আকারের এসব সেতুর নির্মাণ ব্যয় দ্বিগুণ ধরা হয়েছে বলে উপজেলা এলজিইডি বিভাগ দাবি করছে ।,0,52,54
ধরা,সামগ্রিকভাবে বাজেটে যে আয় ও ব্যয় ধরা হয়েছে তা বাস্তবায়নে সুনির্দিষ্ট পরিকল্পনা নেই ।,0,35,37
ধরা,ছয় দলের থাকা-খাওয়া এবং পাঁচ বিদেশী দলের যাতায়াতের পেছনে খরচ ধরা হয়েছে চার কোটি টাকা,0,63,65
ধরা,অথচ সেই খাতে অন্যায্যভাবে টাকা ধরা হয়েছে । ',0,31,33
ধরা,সব মিলিয়ে আসন্ন বাজেটে সরকারের এসব বিষয়ে ব্যয় ধরা হয়েছে লাখ হাজার কোটি টাকা ।,0,49,51
ধরা,"বাজেটে মোট রাজস্ব আয় ধরা হয়েছে লাখ হাজার কোটি টাকা , যা জিডিপি'র শতাংশ ।",0,22,24
ধরা,"এর মধ্যে জোনাল অফিস , ওয়ার্ড অফিস ও কমিউনিটি সেন্টার নির্মাণে কোটি টাকা , পাবলিক হল কমপ্লেক্স নির্মাণে কোটি , কবরস্থান , সিমেট্রি , শ্মশানঘাট নির্মাণে কোটি , ওয়ার্ডভিত্তিক কাঁচাবাজার নির্মাণে কোটি , কেসিসি সুপারমার্কেট , সন্ধ্যা বাজার নির্মাণে কোটি এবং কসাইখানা নির্মাণে কোটি টাকা ব্যয় ধরা হচ্ছে ।",0,289,291
ধরা,প্রতিটি ফেরিঘাটের জন্য প্রাথমিক ভাবে ব্যয়বরাদ্দ ধরা হয়েছে কোটি টাকা ।,0,49,51
ধরা,এই রমজান থেকে সামনের বছরের রমজান পর্যন্ত প্রত্যাশিত খরচ ধরা হয়েছে X = ( সমস্যা নিরসন না হলে ),0,56,58
ধরা,"চলতি অর্থবর্ষে যে আর্থিক ঘাটতি অনুমান করা হচ্ছে , তার মধ্যে জিএসটি প্রণয়নের কারণে , কোটি টাকা ধরা হয়েছে ।",0,95,97
ধরা,"প্রকল্পের ব্যয় সম্পর্কে অধ্যাপক মোঃ মনজুর হোসেন বলেন , এই প্রকল্পের মোট ব্যয় ধরা হয়েছিল কোটি লাখ টাকা ।",0,79,81
ধরা,"যমুনা রেলওয়ে সেতু নির্মাণ প্রকল্প , এর ব্যয় ধরা হয়েছে হাজার কোটি লাখ টাকা ।",0,46,48
ধরা,আর বৈদেশিক ঋণের সুদ পরিশোধ বাবদ ধরা হয়েছে হাজার কোটি টাকা ।,0,32,34
ধরা,এ বাজেটে রাজস্ব আয় ধরা হযেছে লাখ হাজার টাকা এবং উন্নয়ন খাতের আয় ধরা হয়েছে লাখ হাজার টাকা ।,0,20,22
ধরা,"এবার মৌসুমে লাখ টনের বেশি আম উৎপাদনের লক্ষ্যমাত্রা ধরা হয়েছে , যা গতবছর উৎপাদন ছিল লাখ হাজার টন ।",0,51,53
ধরা,আমেরিকাতে সিম ছাড়া এই ফোনের দাম ধরা হয়েছে ডলার আবার ইউরোপ আর এশিয়াতে এটা পড়বে ডলারের মত ।,0,33,35
ধরা,এর আগে মূল চুক্তিতে কোটি লাখ টাকা ব্যয় ধরা হয়েছিল ।,0,40,42
ধরা,টিকিটের সর্বোচ্চ মূল্য ধরা হয়েছে দুই হাজার টাকা ।,0,23,25
ধরা,কিন্তু ধরা পড়ার ভয়ে ব্যাথা পেয়েও চোর ব্যাটা নিশ্চুপ !,1,7,9
ধরা,"এমন অভিযানের সফলতা আসবে তখন , যখন আমারা দেখবো যে , মাদক সেবনকারীকে ধরে তার কাছ থেকে তথ্য নিয়ে দুইএকজন মাদক ব্যবসায়ীকে ধরা হয়েছে ।",1,67,69
ধরা,একটা সময় আমি হঠাৎ লক্ষ্য করলাম যে নিশি আমার হাত ধরেছে । আমি খানিকটা অবাক হলাম । আমার পরিচয়টা সত্যিই বলতে কি এখনও হাত ধরার মত হয় নি । ওর সাথে পরিচয়টাও হয়েছিলো বেশ অদ্ভুদ ভাবে ।,1,119,122
ধরা,আচ্ছা IP নিয়া কোনো গেনজাম করব না তো এর আগের বার ftp সিতে খাইয়া দিসিলাম পরে বাসায় সমসসা হইছে এইটা তে ip নিয়া ধরা খাবার কোনো chance আছে ?,1,112,114
ধরা,"শুধু জেলে নয় , মাছ ধরার সঙ্গে সম্পৃক্ত ব্যবসায়ী , শ্রমিক , পরিবহন শ্রমিক , এমনকি ক্ষুদ্র চা-পান দোকানিদের জীবনেও স্থবিরতা নেমে এসেছে ।",1,20,23
ধরা,সকাল সকাল ফেসবুকে স্প্যাম এ ধরা খাইয়া আইলাম,1,28,30
ধরা,বারোশো ত্রিশ সালে ভূমধ্যসাগর থেকে আগত শরনার্থী আর ফ্ল্যাজলেট্যান্টদের ( নেদারল্যান্ডসের ছোট একটি গ্রামের অধিবাসী যাদের পেশা ছিলো মাছ ধরা আর কাঁদামাটি দিয়ে রাস্তা বানানো ) দ্বারা এই গ্রামটি প্রতিষ্ঠিত হয়েছিল ।,1,133,135
ধরা,একদিকে ভবঘুরে ও সন্দেহজনক আচরণের লোকজন অপরদিকে কখন মরিচা ধরা গর্তে পা আটকে যায় কে জানে ।,1,57,59
ধরা,ধরা খেলে বুঝবে যুদ্ধ করার মজা ।,1,0,2
ধরা,"পায়ের নিচ দিয়ে কান ধরার কথা সবাই জানে , ছেলেবেলায় পড়া না পারলে সুন্দরী মিস এইরকম মোরগা বানাত ।",1,21,24
ধরা,সে বাড়ির পেছনে এসে দেখলো দোতলার জানালাটা ধরা ছোঁয়ার বাইরে ।,1,42,44
ধরা,"দক্ষিণ থাইল্যান্ডে এমন একটি চক্র রয়েছে , যারা দীর্ঘদিন ধরেই বাংলাদেশীদের বিভিন্ন খামারে বা মাছ ধরার ব্যবসায় ক্রীতদাসের মতো কাজ করাচ্ছে ।",1,96,99
ধরা,"আবু মোহাম্মদ বলেন , ' শীতের রাতে পঙ্গপাল ধরা হয় ( ওই সময় এরা উড়তে পারে না ) এবং আমরা সৌদি আরব থেকে এগুলো আমদানি করি । '",1,41,43
ধরা,পুকুর লীজ বা মাছ ধরার বিষয়ে তিনি ( মজিদ খান ) ও শরীফ উল্লাহর কোন সংশ্লিষ্টতা ছিল না ।,1,17,20
ধরা,"আমি জানতাম ধরা পড়লে আমার হাড়গোড় আস্ত থাকবে না , কিন্তু ওই সময়টায় খিদে সহ্য করা যায় না ।",1,11,13
ধরা,আমাদের দেশের প্রতিষ্ঠান গুলি যে অনেকগুলি কারণের জন্য একসময় ধরা খায় তার একটা হল সেই তথাকথিত কানেকশন থিওরীর প্রযোগ ।,1,60,62
ধরা,"গুড জব রিপন , আমার মনে হয় তিস্তা নিয়ে একটা বইয়ের কাজ ধরার সময় হয়ে গেছে ।",1,56,59
ধরা,মেয়েটা চালাকি করে দুইজনকেই নয়-ছয় বুঝিয়ে রাখে কিন্তু টাকা চুরি করার মুহুর্তে বিষয়টা ধরা পড়ে যায় ।,1,88,90
ধরা,"যদি একাকীত্বের মানে এসে আমার কাছে ধরা দেয় , কিন্তু সে আসে না , সে কি আর মানুষের মতো যে এসে বসে থাকবে পার্কের বেঞ্চে ।",1,34,36
ধরা,"একেবারে প্রথম দৃশ্যে যে পুকুরে মাছ ধরার দৃশ্য আমরা দেখি , স্থির নিষ্কম্প শালুক আর পদ্ম ডাঁটার পাশে ছিপ ফেলে প্রত্যাশী দুটি বালকের মুখে ছবির প্রাথমিক প্রেক্ষিত যে দৃশ্যে পূর্ণ নির্মিত স্বমহিমায় , সেখানে পথের পাঁচালী-র পুকুরের জলের ওপর ক্যামেরা প্যান করানোর স্মৃতিগুলো আবছা দাগ কাটে ।",0,35,38
ধরা,"তার আগে সরকারের একজন-দুজন নেতা, একজন-দুজন সচিব বিমানবন্দর পেরোলেন বা পেরোতে গিয়ে ধরাও পড়লেন।",1,83,86
ধরা,"প্রশ্ন উঠেছে , ' অপরাধীদের ' ধরার ব্যাপারে এতটা তাকিদ ও দায়িত্ববোধ তো এর আগে পুলিশের মধ্যে দেখা যায়নি ।",1,29,32
ধরা,"কিন্তু বিমান ধরার আগে তিনি দেখতে পান , তাঁর বাগটিই বিমানে তোলা হয়নি ।",1,13,16
ধরা,দিল্লির বিমান ধরার তাড়ায় সভা শেষ হওয়ার আগে চলে যান শরদও ।,1,14,17
ধরা,"দলের ম্যানেজার খালেদ মাহমুদ লন্ডনগামী টিম বাস ধরার আগে অবশ্য আশ্বস্ত করলেন, টুকটাক চোটাঘাত আছে, তবে দুশ্চিন্তা করার মতো নয়, ‘খেলতে গেলে একটু-আধটু চোট-ব্যথা লাগবেই।",1,46,49
ধরা,তৃতীয়বার ধরার আগে নিজেকে শান্ত করার চেষ্টা করল ।,1,10,13
ধরা,প্রশ্নটা শুনেই কাপ্তানকে আগলে গাড়ি ধরার তাড়ায় লঙ্কা ম্যানেজার ।,1,36,39
ধরা,এই বছর দেড়েক আগে বাসন্তীর কী যে রোগ হল ধরাই গেল না ।,1,40,43
ধরা,"দুষ্টু লোকেরা তাদের বোঝাতেও সক্ষম হলো এই বলে যে , বেজি যেভাবে মুরগি ধরে নিয়ে যাচ্ছে তাতে কিছুদিনের মধ্যে গ্রামে ডিম আগে নাকি মুরগি আগে , এ নিয়ে কোনো বাজি ধরাই হবে না ।",1,156,159
ধরা,"প্রিমিয়ার লিগ শুরুর আগে মনে হচ্ছিল , এবার ' চাকার ' ধরাকেই সর্বোচ্চ গুরুত্ব দেবে বিসিবি ।",1,53,56
ধরা,"যেখানে অনেক সাহসী মনোভাবের প্রকাশ ঘটানো হয়েছে , যা এর আগে বলিউডি নায়িকাদের মাধ্যমে অকপটে তুলে ধরার কথা ভাবা যেত না ।",1,96,99
ধরা,বকলিন ফ্রয়েডের আগে চিত্রকলায় মানুষের মনস্তাত্ত্বিক অবস্থা তুলে ধরার চেষ্টা করেছেন ।,1,65,68
ধরা,"শনিবার প্রয়াগরাজের ওই আলোচনাসভার আহ্বায়ক , অল ইন্ডিয়া পিপল্স ফোরামের তরফে কমল উসরি বলেন , ' এলাহাবাদের উড়ান ধরার আগে গোপীনাথন আমাকে ফোন করে জানিয়েছিলেন যে , তিনি আসছেন ।",1,112,115
ধরা,আলাউদ্দিন খলজী চিত্তরকে ধরার আগে পদ্মবাতি এবং তার সঙ্গীগণ তাদের সম্মান রক্ষা করার জন্য জওহর ব্রত করেছিলেন ।,1,24,27
ধরা,"ধোনিরা অস্ট্রেলিয়ার বিমান ধরার আগে সংবাদমাধ্যমে বলা হচ্ছিল , এই সিরিজ টি - টোয়েন্টির মহড়া হতে চলেছে ।",1,27,30
ধরা,"ঢাকা বিমানবন্দরে কলকাতার ফ্লাইট ধরার আগে বাংলাদেশ ক্রিকেটের ' বিগম্যান ' জানাচ্ছেন , "" ইডেনে দারুণ হতে চলেছে গোলাপি বলের টেস্ট ।",1,32,35
ধরা,আগে শুধু ডুডলে এটি পালন করা হলেও এবার থেকে গুগল ট্রান্সলেটরেও বাংলাদেশের এই দিবসকে বিশ্ববাসীর নিকট তুলে ধরার সিদ্ধান্ত Continue Reading »,1,104,107
ধরা,"নিজের পরবর্তী বক্তব্য তুলে ধরার আগে প্রধানমন্ত্রী আরও একবার পরিষ্কার করে দেন যে , তাঁর পক্ষ থেকে কখনই জনগণকে কোনও বিষয়ে ধোঁয়াশায় রাখা হয়নি ।",1,27,30
ধরা,"ঘরোয়া ক্রিকেটে এর আগে একবারই ‘চাকার’ ধরার চেষ্টা করেছে বিসিবি, সেটা ওই ২০০৬-০৭ মৌসুমেই।",1,38,41
ধরা,"সরাসরি নাকচের এই ঘটনায় প্রেসিডেন্ট ট্রাম্পের ' আগুনে মেজাজ ' আর ' সত্যকে গ্রহণ বা তুলে ধরার অক্ষমতা ' তাদের ওপর কিভাবে ন্যস্ত হতে পারে , তা নিয়ে কিছু আলোচনা তো হচ্ছেই ।",1,88,91
ধরা,ধরার জন্য আমি তাদের পিছু পিছু দৌড়ে বেড়াই।,1,0,3
ধরা,"আর আমি মামুলী এক তরুণ - ছাত্র তার সামান্য কিছু ভুল / বিকৃতি / অপবিজ্ঞান তুলে ধরাতে হই - হই করে তেড়ে আসছে সেই লেখকের বাক - স্বাধীনতা নিয়ে যিনি নিজেই বলেন , অসুবিধা আছে ।",1,77,80
