lemma,sentence,sense,start,end
,নাজিম উদ্দিন রোডে পুরানো কারাগারে দায়িত্বে থাকা অবস্থায় আরও নয়জন জ্বরে ভুগলে তাদের নমুনা স্বাস্থ্য অধিদপ্তরে পাঠানো হলে মঙ্গলবার ( এপ্রিল ) সবার শরীরে করোনার সংক্রমণ ধরা পড়ে ।,,,
,রফিকুল ইসলাম বীরউত্তম'কেই নৌকার হাল ধরার দায়িত্ব দেবেন ।,,,
,রাতের বেলা বাড়ির কর্ত্রী অন্ধকারের ভিতর বুঝতে পারলেন যে ফাঁদে কিছু একটা ধরা পরেছে ।,,,
,এবার মুশফিকদের পালা ক্যারিবিয়ান দ্বীপপুঞ্জে নিজেদের ঠিকঠাক মেলে ধরা ।,,,
,সফলতার সাথে এই কারাগার ভেঙে পালাতে পারলেও বছর পর তিনি আবার ধরা পড়েন এবং তাকে পাঠানো হয় আমেরিকার সবচেয়ে সুরক্ষিত কারাগার অ্যালকাট্রাজে ।,,,
,"মেলডোনিয়াম যারা তৈরি করে , সেই ডি এস এম গ্রুপের চিফ এক্সিকিউটিভ সের্গেই সুলিয়াক বলেন , '' আমাদের দেশের অন্যতম সেরা তারকার ডোপ পরীক্ষায় ধরা পড়াটা এই ওষুধের দুর্দান্ত বিজ্ঞাপন হিসেবে কাজ করেছে । ''",,,
,"যেমন ধরা যাক , সেদিন এক পত্রিকায় পড়লাম , রানী মুখার্জীর ভীষণ দুর্দিন ।",,,
,ব্যবসায়ীদের কাস্টমার ধরার মতো বিষয় ।,,,
,এটিকে ফোনের হার্ডওয়্যারের মধ্যেই ধরা হয় এবং একে ফোনের বাইরে বের করা সম্ভব নয় ।,,,
,"বেশ , বোলো না , – কেমিক্যাল পরীক্ষায় ধরা পড়োবেই । """,,,
,এসব বিজ্ঞাপনের ফাঁকে ফাঁকে তুলে ধরা হতো পত্রিকার সূচি ।,,,
,"এদিকে , পানি নামতে শুরু করায় ধরা পড়ছে বিভিন্ন প্রজাতির মাছ ।",,,
,কিন্তু আরেক প্রান্তে অফ স্পিনার রোহান মুস্তাফাকে প্রথম ওভারেই উড়িয়ে মারতে গিয়ে মিড উইকেট সীমানায় ধরা পড়েন সাব্বির ।,,,
,"বুঝবে , এত নিশ্চিন্তে হেনস্থা চালিয়ে যাওয়া যাবে না , ধরা পড়লে সর্বনাশ ।",,,
,প্রস্তাবিত প্রকল্পগুলোর মধ্যে সবচেয়ে বড়ো পায়রা বন্দরের প্রথম ধাপের অবকাঠামো নির্মাণ খরচ ধরা হয়েছে এক দশমিক বিলিয়ন ডলার ।,,,
,"এরপর বাংলাদেশ স্বাধীন হলে বঙ্গবন্ধুর মাথায় ছাতা ধরা , বঙ্গবন্ধু হত্যাকাণ্ডের পর জিয়া , এরশাদ , খালেদা জিয়া হয়ে এখন বেশ শেখ হাসিনার মাথার ওপর ছাতা ধরে আছে ছত্রীধরেরা ।",,,
,পুকুরে ইলিশ ধরা পড়ার খবরে এলাকায় চাঞ্চল্য সৃষ্টি হয়েছে ।,,,
,"তিনি বলেন , এরই মধ্যে যাদের ধরা হয়েছে তারা সবাই অনুপ্রবেশকারী ।",,,
,আর দাম ধরা হয়েছে হাজার ডলার ।,,,
,অকালে টাক পড়ে যাওয়া প্রতিরোধ ও চুলের পাক ধরা ঠেকাতে আমরা কত কিছুই না করি ।,,,
,সেই পরীক্ষায় করোনা পজিটিভ ধরা পড়ে আমার শরীরে ।,,,
,তাই শুষ্কতা থেকে রক্ষার খুবই সহজ উপায় আপনাদের জন্য তুলে ধরা হল ।,,,
,কিছুদিন পর কল্পনা এবং তার কিছু সহযোদ্ধা পুলিশের হাতে ধরা পরেন ।,,,
,প্রতিবেশীদের অভিযোগের ভিত্তিতে ওই দুই জনকে ধরা হয় ।,,,
,"তবে চীনের পক্ষ থেকে জানানো হয়েছে , মাছ ধরার নৌকার জন্য তেল বিক্রি করছিল ওই জাহাজটি ।",,,
,পরীক্ষা-নিরীক্ষা করে রাত সাড়ে টার দিকে ধরা পরে তার নাড়ি ফুটো হয়ে গেছে ।,,,
,বেসরকারি মানবাধিকার সংগঠন অধিকারের বার্ষিক মানবাধিকার প্রতিবেদন তে এ তথ্য তুলে ধরা হয়েছে ।,,,
,"আমাদের এই পৃথিবী যদি গোলকার বা গোলের মত আকৃতি না হত তাহলে কেমন হত ? ধারণা মতে , জিওমেট্রিক্যাল যে কয়টা বেসিক শেপ দিয়ে আমরা সব সময় কাজ করি বা দেখা যাবে পরীক্ষা করলে এইগুলোর আলোকে করা প্রাকৃতিক ডিজাইনকে স্টেবল ধরা যেতে পারে ।",,,
,এরপর সুরঙ্গা লাকমালের আরেকটি শর্ট বল ঠিকমতো খেলতে না পেরে শর্ট লেগে সিলভার হাতে ধরা পড়েন মার্শাল আইয়ুব ।,,,
,এই ফোনটির প্রত্যাশিত মূল্য ধরা হয়েছে ডলার ।,,,
,"ট্রেনের চাকা ঘুরতে থাকার সঙ্গে সঙ্গেই সময়ের আবর্তে ঘনিষ্ঠতা বাড়তে থাকে দুজনের , ট্রেন গার্ডের কাছে হাতেনাতে ধরা পড়েও নিজের বীরত্বের কাহিনীর প্রমাণ হিসেবে খবরের কাগজের কাটিং দেখিয়ে এবং সুরাকে নিজের প্রেমিকা পরিচয় দিয়ে এ যাত্রা বেঁচে যায় আলিওশা ।",,,
,ডিগ্রি পদ্ধতিতে সমকোণকে ° ধরা হয় ।,,,
,"আপনি তো হাওর এলাকায় বড় হয়েছেন , হাওরে কখনো মাছ ধরার সুযোগ পেয়েছেন ?",,,
,আর নতুন প্যাকেজ-৩-এর ব্যয় ধরা হয়েছে লাখ হাজার টাকা ।,,,
,এছাড়াও কোম্পানিটি এ উপলক্ষে কিছু ধারাবাহিক শর্টফিল্ম প্রচারের মাধ্যমে ' দ্য ফ্রেন্ডস ডে ' উদযাপন করেছে যে শর্টফিল্মগুলোতে সারা পৃথিবী থেকে বাছাই করা পাঁচটি উল্লেখযোগ্য বন্ধুত্ব তুলে ধরা হয়েছে ।,,,
,কারো কারো জীবনে হয়না আর প্রিয় হাতটি ধরা ।,,,
,সাল এমনিতেই সারা বিশ্বের কাছে এক বিষের বছর হিসাবে ধরা দিয়েছে ।,,,
,আইনশৃঙ্খলা বাহিনীর হাতে মাঝে-মধ্যে কিছু মাদক ধরা পড়লেও সিংহভাগ মাদকের চালান নানা হাত ঘুরে চলে যাচ্ছে রাজধানীসহ বিভিন্ন স্থানে ।,,,
,"এবারের আখ মাড়াই মৌসুমে মাড়াই দিবসে লাখ মেট্রিক টন আখ মাড়াই করে হাজার মেটিক্র টন চিনি উৎপাদনের লক্ষমাত্রা নির্ধারন করা হয়েছে , চিনি আহরনের হার ধরা হয়েছে ভাগ ।",,,
,লোভনীয় প্রচার চালিয়ে কানাডাকে উন্নয়নশীল দেশগুলোর মানুষের কাছে ভূপৃষ্ঠের স্বর্গ হিসেবে তুলে ধরা হয় ।,,,
,ঝিম ধরা পাশ ফেরা ।,,,
,"আমাদের এলাকায় "" ফিটিং ধরা "" এর ব্যাখা এমনই ।",,,
,যার ব্যায় ধরা হয়েছে কোটি লাখ টাকা ।,,,
,অবশ্যই বইটিকে একটি নিরীক্ষাধর্মী কাজ হিসেবে ধরা যায় ।,,,
,সার্চ ইঞ্জিনের প্রথম পাতায় উপস্থিত হওয়া কোন একটি ওয়েবপেইজকে সার্চ ইঞ্জিনের মধ্যস্থতায় অনুসন্ধানকারীর সামনে তুলে ধরার জন্য একটি জুতসই কলাকৌশল হলো এসইও * ।,,,
,তাহলে কি মালতিদিদি জাদুকর সামাদিনের লোকজনের হাতে ধরা পড়ে গেল ?,,,
,"আনন্দ ধারা বহিছে ভূবনে , আনন্দ ধারা বহিছে ভূবনে দিন ও রজনী কত অমৃত রস উথলি যায় অনন্ত গগনে আনন্দ ধারা বহিছে ভূবনে , আনন্দ ধারা বহিছে ভূবনে পান করে রবি শশী অঞ্জলি ভরিয়া সদা দীপ্ত রহে অক্ষয় জ্যোতি পান করে রবি শশী অঞ্জলি ভরিয়া সদা দীপ্ত রহে অক্ষয় জ্যোতি নিত্য পূর্ণ ধরা জীবনে কি রণে আনন্দ ধারা বহিছে ভূবনে বসিয়া আছো কেন আপন মনে , স্বার্থ নিমগ্ন কি কারনে বসিয়া আছো কেন আপন মনে , স্বার্থ নিমগ্ন কি কারনে চারিদিকে দেখ চাহি হৃদয় প্রসারি ক্ষুদ্র দূঃখ সব তুচ্ছ মানি চারিদিকে দেখ চাহি হৃদয় প্রসারি ক্ষুদ্র দূঃখ সব তুচ্ছ মানি প্রেম ভরিয়া লহ শুন্য জীবনে আনন্দ ধারা বহিছে ভূবনে , আনন্দ ধারা বহিছে ভূবনে দিন ও রজনী কত অমৃত রস উথলি যায় অনন্ত গগনে আনন্দ ধারা বহিছে ভূবনে , আনন্দ ধারা বহিছে ভূবনে ছবিঃ রাতারগুল ফরেস্ট , গোয়াইন ঘাট , সিলেট ।",,,
,"রক্ষী বাহিনী দ্বারা সরকারের লালঘোড়া দাবড়ানো ও প্রায় রাজনৈতিক কর্মীকে হত্যাকরণ , ক্ষমতাসীনদের ব্যাপক দূর্নীতি ও খাদ্য প্রচারের ফলে সালে মানবসৃষ্ট দূর্ভিক্ষের মনঃন্তরে প্রায় দেড় লক্ষ মানুষ অনাহারে মারা যাওয়া , সবগুলো রাজনৈতিক দল বাতিল করে দিয়ে একদলীয় বাকশাল কায়েম করে চিরস্থায়ীভাবে ক্ষমতার মসনদ দখল করার মাধ্যমে মহান মুক্তিযুদেধর চেতনা , গণতন্ত্রকে হত্যা করা , ইত্যাদি কারনে দেশে যে শাসরুদ্ধকর পরিস্থিতি সৃষ্টি হয়েছিল তার বহি ; প্রকাশ বন্ধ করতেই সরকার গণমাধ্যমের টুটি চেপে ধরার সিদ্ধান্ত নেয় ।",,,
,সহজে ধরাই যায় না ।,,,
,এক হাতে টিকিট আরেক হাতে ধরা ট্রাভেল ব্যাগ ।,,,
,বাংলাদেশের ভৌগলিক নির্দেশক ( জিআই ) পণ্য হিসেবে ইলিশের যে জাতীয় গুরত্ব রয়েছে তা এই অনুষ্ঠানে তুলে ধরা হয় ।,,,
,"নইলে এই ভূস্বর্গের অপরূপ সৌন্দর্য কাননে যাদের নিত্য বসবাস , তাদের কাছে সুন্দরের আবেদন পৃথকভাবে ধরা পড়বে কেন !",,,
,তার মধ্যে কয়েকজনের মতামত তুলে ধরা হলো ।,,,
,সে জন্যই তার লেখাটি তুলে ধরা ।,,,
,গত আগস্ট রাহুল সংঘ নামে এক শার্প শ্যুটারকে গ্রেপ্তার করে ফরিদাবাদ পুলিশের ক্রাইম ব্রাঞ্চ৷ সাথে আরও চার ব্যক্তি ধরা পড়ে ।,,,
,সে এখনও ধরা পড়েনি ।,,,
,"এবারকার যুবক অত্যন্ত ধৈর্য্যশীল , আমি ধরা না পর্যন্ত সে ফোন করেই যেতে থাকে ।",,,
,সেখান থেকে হেঁটে গিয়ে পিরামিড দেখে ফেরার সময় পিরামিডের গেটের সামনে থেকে ফেরার ট্যাক্সি / উবার ধরা যায় ।,,,
,এমনটা ধরা পড়েছে অনেকবার ।,,,
,লোকটি ধরা গলায় বললেন ।,,,
,বেসরকারি খাতে ঋণ প্রবৃদ্ধি আগেকার দশমিক শতাংশ থেকে কিছুটা সংশোধন করে দশমিক শতাংশ ধরা হয়েছে ।,,,
,নদীর ধারে বাড়ি হলেও এই সব বিলই ছিল তাঁদের মাছ ধরার আসল জায়গা ।,,,
,আবু জুবেইদা ওসামা বিন লাদেনের সঙ্গী আবু জুবেইদা - এর মার্চে ধরা পড়ে পাকিস্তানের ফয়সালাবাদ থেকে ।,,,
,উদ্দীপকের ইশতিয়াকও আন্তর্জাতিক মাতৃভাষা দিবসের তাত্পর্য পরোক্ষভাবে তার সহপাঠীদের কাছে তুলে ধরার পরিকল্পনা করে ।,,,
,পাঠকদের জন্য সে বাস ও ধাক্কার চিত্র তুলে ধরার চেষ্টা করব ।,,,
,এর আগে শুক্রবার ভোরে পদ্মা নদীতে সাদ্দাম সরদার নামের এক জেলের জালে বিশালাকৃতির বাঘাইড় মাছটি ধরা পড়ে ।,,,
,"মতিঝিল আইডিয়াল , সাহিন , প্রিপারেটরী ও মনিপুর স্কুলে প্রথম শ্রেণীতে ভর্তি ফি ধরা হয়েছে যযথাক্রমে , , ও টাকা ।",,,
,এই ছাতা না ধরা নিয়ে আমার অনেক কাহিনী আছে ।,,,
,"উল্লেখ্য , সেলিম খানের করোনা ধরা পড়ে ডিসেম্বর ।",,,
,সিস্টেমের কোন সমস্যা ধরা পরলে এটি বিভিন্ন ধরনের বীপ কোড জেনারেট করে যা মাদারবোর্ডের সাথে সংযুক্ত স্পিকারে বেজে ওঠে ।,,,
,"বন্ধুকে আমি দেখি , যার চোখে তাকালে আমার ভুলভ্রান্তি ধরা পড়ে ।",,,
,সেখানেই শহরের ছবিটা ধরা পড়েছে ।,,,
,এ বছরেই কর্তৃপক্ষ হাসপাতালটি পরিদর্শন করে ফাটল ধরা কক্ষগুলো মেরামতের ব্যবস্থা করবে ।,,,
,তার তৈরি করা কিছু ভাস্কর্যের তালিকা নিচে তুলে ধরা হলো ।,,,
,"পিডিবি সূত্র জানায় , তিন বছর মেয়াদি ফেঞ্চুগঞ্জ মেগাওয়াট বিদ্যুৎকেন্দ্রে প্রতি ইউনিট বিদ্যুতের জন্য মাসিক ভাড়া ধরা হয়েছে মার্কিন ডলার ।",,,
,আগে শুধুমাত্র ডায়াবেটিস ধরা পড়েছিল ।,,,
,"জার্মান ভাষাশিক্ষার একটা কোর্স শুরু হবে সামনের মাসেই , আর আমারো ফিরে গিয়ে সেটা ধরার কথা ছিলো ।",,,
,"এখানে শীতে যেমন এক রূপ ধরা দেয় ভ্রমণ পিপাসুদের কাছে , বর্ষায় অন্যরূপে হাজির হয় ভ্রমণ পিপাসুদের কাছে ।",,,
,স্বাধীনতাসহ সকল তথ্যই শিশুদের সামনে সঠিক ভাবে তুলে ধরা উচিত ।,,,
,"অন্ধকারে শিপ্রাকে জড়িয়ে ধরার জন্য হাত বাড়াতেই চাপাস্বরে মনু বলল , এখন এত রাত করে বাড়ি ফিরো না ।",,,
,"স্থানীয় ইউপি সদস্য আমজাদ হোসেন বলেন , প্রত্যেক ইরির সময়ে রাতের অন্ধকারে মাছ ধরার উদেশ্যে সুইচ গেট খুলে দেয় ।",,,
,"ও পালাতে চেষ্টা করে , কিন্তু দু-হাত দিয়ে চেপে ধরার মতাে অন্ধকারটা ওকে নড়তে দেয় না ।",,,
,অন্ধকারে জোনাকি ধরার কাজটি সহজ নয়তবু পাখিদের মতো একটু আলোর অন্বেষণেছুটেছি দেশ থেকে দেশান্তরেপৃথিবীর এক প্রান্ত থেকে অন্য প্রান্তেপাড়ি দিয়েছি সাত সমুদ্র তেরো নদী।,,,
,"পুলিশের বিশ্বাস , শেষ ট্রেন ধরার জন্যে ধড়ফড় করতে গিয়ে অন্ধকারে আর জল - ঝড়ে পথ হারিয়ে নদীর পাড়ে চলে যায় ।",,,
,অ্যারিজোনায় মরুভূমির অন্ধকারে শিকার ধরার অপেক্ষায় বসেছিল মারাত্মক বিষাক্ত র্যাটেলস্নেক ।,,,
,"আমাদের ছোটবেলায় তো আমরা অনেক রকম ভূতকে জানতাম , যেমন ধরো – ব্রহ্মদত্যি বেল গাছের ডালে খড়ম পায়ে উবু হয়ে বসে গুড়ুক গুড়ুক করে থেলো হুঁকোতে তামাক খায় – ইয়া বড় বড় দাঁত – গলায় মোটা পৈতে – মাথার লম্বা টিকিতে গাঁদা ফুল ঝুলছে ; রোগা সিড়িঙ্গে গেছো ভূত সড়াৎ করে সুপুরি গাছের মাথায় উঠে মেজাজে পা দোলায় আর গাছের নিচে দিয়ে রাত্রে কেউ গেলেই পায়ের বুড়ো আঙ্গুলের ফাঁকে চেপে ধরে ; একানড়ে তাল গাছের মত খাড়া আর এক ঠেঙ্গা লম্বা – এক মাথা ঝাকড়া চুল – কপালের মাঝখানে একটাই গোল চোখ অন্ধকারে ধক ধক করে জ্বলে ; শাকচুন্নী লাল কালো চৌকো কাটা গামছা গায়ে বিল অথবা জলাতে লম্বা লম্বা পা ফেলে পুঁটি মাছ ধরে সেগুলোকে কাদায় পুতে রাখে পচা পুঁটি মাছ খাবে বলে ; স্কন্ধকাটার মাথা নেই – চোখ দুটো বুকের মধ্যে – সন্ধ্যের পর যখন তখন বাঁশবনের ধারের রাস্তা দিয়ে দৌড়ায় বাচ্চাদের ধরার জন্য ; মামদো ভূত আধো অন্ধকারে লোক জনকে উটকো ভয় দেখিয়ে আনন্দে মাটিতে গড়াগড়ি খেয়ে বিটকেল আওয়াজে হাসতে থাকে ; পেত্নী সন্ধ্যেবেলা বাড়ির আনাচে কানাচে ঘুরে থেকে থেকে খোনা গলায় পান্তাভাত খেতে চায় ; আরো কত ধরনের ভূত আর এই ভূতেদের সংসারে ব্রহ্মদত্যি হলো সব থেকে সম্মানিত ভূত ।",,,
,"বড় হবার পরে কোনদিন সেই ছোটো বেলার ছোটো ছোটো খুশী গুল খুঁজে পাইনি , তাই এই রাতের অন্ধকারে ভাবলাম একটু খানি সেই আনন্দ টাকে হাতের মুঠির মাঝে ধরার ।",,,
