lemma,sentence,sense,start,end
,"কতকগুলি যোগী সম্যক্রূপে দেবযজ্ঞই ( দেবতার উদ্দেশ্যে যজ্ঞই ) অনুষ্ঠান করেন ; কোন কোন যোগী পূর্বোক্ত প্রকারে ব্রহ্মরূপ অগ্নিতে যজ্ঞরূপ উপায় দ্বারা যজ্ঞাদি কর্মসকল ( কর্মত্যাগরূপ ) আহুতি প্রদান করিয়া থাকেন ; কেহ কেহ সংযমরূপ অগ্নিতে শ্রোত্রাদি ইন্দ্রিয়গণকে , আর কেহ কেহ ইন্দ্রিয়রূপ অগ্নিতে শব্দাদি বিষয় সকল আহুতি দিয়া থাকেন ।",,,
,তারই দুই মেয়ের মধ্যে ছোট মেয়ে মায়াকে এমন ভয়ংকর রূপে ঘুরে বেড়াতে দেখা যাচ্ছে ।,,,
,অভিযোগ করলেন কর্ণাটকের কারা বিভাগের ডেপুটি ইনস্পেক্টর জেনারেল রূপা মুদগিল ।,,,
,মুনিরূপে বসে আছে সঙ্গে পুণ্যজন ।,,,
,ইয়াকুব রূপনাই গাছপাড়া গ্রামের ইয়াসিন আলীর ছেলে ।,,,
,পরের বছর ফ্রান্স এবং লন্ডনে দুবার তিনি রূপো জেতেন ।,,,
,"রূপা বলল , আছে সুমি নাম ।",,,
,নিজেকে আকর্ষণীয় রূপে উপস্থাপনে হাসির কোনো তুলনা হয় না ।,,,
,রূপা হত্যার মামলায় দুটি দিক থেকেই দৃষ্টান্ত স্থাপিত হয়েছে।,,,
,৮-০০ রূপে রূপে রূপবান।,,,
,নতুন রূপে আসছে মাইক্রোসফটের এক্সবক্স ।,,,
,"কারণ , যেই আপনি আপনাকে এতো ভালবাসেন , সেই আপনি কখনোই নিজেকে পৃথিবীর বুকে মিথ্যাবাদী রূপে উপস্থাপন করে , নিজেকে অপমানিত করতে পারেন না ।",,,
,তবে শুধু ইন্দ্রানীই নয় মহালয়ার এই বিশেষ অনুষ্ঠানে দুর্গা রূপে দেখা যাবে অভিনেত্রী শ্রাবন্তীকেও ।,,,
,অলঙ্কারে এমন ঠেসে গেছে লেখা যে আসল রূপটি আর চেনা যাচ্ছে না ।,,,
,অর্শ বিবাহঃ কন্যার পিতাকে ধর্মীয় কাজে ব্যবহার করার জন্য এক জোড়া গো - মহিষ দিয়ে পাত্র কন্যাকে পত্নীরূপে গ্রহন করতো ।,,,
,আর এই স্বাধীন দেশের জাতিরজনক রূপে আবির্ভাব বা অভিষেক হলো বঙ্গবন্ধু শেখ মুজিবের ।,,,
,দুই বা ততোধিক শব্দসমষ্টি একত্রে মিলিত হয়ে বক্তার মনের ভাব সম্পূর্ণ রূপে প্রকাশ করলেই কেবল তাকে sentence বা বাক্য বলা যাবে ।,,,
,"পরিচয় বেশী দিনের নয় , কারণ উভয়েই অল্প কিছুদিন পূর্বে চাকুরি ব্যপদেশে এই শহরে আসিয়াছেন এবং দৈবাৎ পাশাপাশি দুইটি বাড়িতে ভাড়াটে - রূপে আশ্রয় লইয়াছেন ।",,,
,ফ্রয়েডীয় মনোবৈকল্যই এ গল্পে প্রকট রূপে প্রকাশিত ।,,,
,সেই আদি মহাবিশ্বের [ Baby universe ] সাক্ষীরূপে পাওয়া যায় এই নিউট্রিনোকে ।,,,
,"তবে , আরো ভয়াবহ রূপে ।",,,
,"কৃত্রিম আর প্রাকৃতিক - এ দুয়ের মিশ্রণে বাংলাদেশ সেনাবাহিনী সাজেকের রূপে এনে দিয়েছে এক অন্য রকম ভালো লাগার অনুভূতি , দেখলে মনে হবে যেন সাজেক ভ্যালি উন্নত বিশ্বের কোনো পাহাড়ি জনপদের প্রতিচ্ছবি ।",,,
,"নীলাম্বর চুপ করিয়া মনে মনে নানারূপে আবৃত্তি করিয়া দেখিতে লাগিল , কথাটা ঠিক কি রকম করিয়া পাড়িতে পারিলে খুব সম্ভব বিরাজের করুণা উদ্রেক করিবে ।",,,
,"চুরি , প্রতারণা , খুন , অকারণে অন্যকে আঘাত করা - এমন হাজারো পাপকাজ মানুষ করে চলে এবং তার উপর ভিত্তি করেই নির্ধারিত হয়ে যায় পরের জন্মে ঠিক কী রূপে জন্মগ্রহণ করবে সে ।",,,
,"কুড়ির দশকের মাঝামাঝি , একদা ব্রিটিশ - বিরোধী সংগ্রামী বীর সাভারকর হিন্দুত্বের প্রধান তাত্ত্বিক প্রবক্তা ও হিন্দু মহাসভার নেতারূপে আত্মপ্রকাশ করেন ।",,,
,"রূপা , গোল্ডপ্লেটেড , অক্সিডাইজড , স্টোন - রয়েছে নানারকমের , ডিজাইনের নাকফুল ।",,,
,স্কুলে থাকার সময় প্রেমের এই সরল রূপটা দিব্যি ছিল ।,,,
,"ট্যাক্স হ্যাভেন হচ্ছে সেই রকম জায়গা, যেখানে অবশ্যম্ভাবীরূপে আইন লঙ্ঘন না করে টাকা পাঠানো যায়।",,,
,তাঁর সে নিরলস প্রচেষ্ঠাটি মানব জাতির জন্য এতটাই শিক্ষণীয় যে বিবি হাজেরার সে সূন্নত প্রতিষ্ঠা পেয়েছে হজ্বের ফরজ বিধান রূপে ।,,,
,"তিনি যেমন মহান আল্লাহতায়ালাকে এ বিশ্বজগত ও সকল সৃষ্টিকূলের লা - শরিক স্রষ্টা রূপে সনাক্ত করেন , তেমনি তাঁর প্রতিটি হুকুমের প্রতি আত্মসমর্পণকে মানব জীবনের মূল এজেন্ডা রূপে নির্ধারণ করেন ।",,,
,"এই সমস্ত দস্যু ও শিক্ষীত শয়তানদের উচিত মূলক শাস্তি হওয়া প্রয়োজন , যাতে দেশ এই সমস্ত কূসংস্কার থেকে মূক্তি পায় , এবং নারী জাতির প্রতি ইসলামের দেয়া স্বাধীনতা পূরনাঙ্গ রূপে বাস্তবায়িত হয় ।",,,
,"ছবির চরিত্রগুলির আপাত চেহারায় বাদশাহি ঢঙের সঙ্গে মিশে আছে আটপৌরে রূপও , ফার্সির ছাঁদে আসলে লেখা বাংলা ।",,,
,অনুষ্ঠান শুরু হয় সম্মেলক কণ্ঠে জসীম উদ্দীনের লেখা গান ' ওই না রূপে নয়ন দিয়ে ' পরিবেশনের মধ্য দিয়ে ।,,,
,রূপসী তোমার রূপে,,,
,এ রূপটা আমরা দেখে আসছি পাকিস্তানের সময়কাল থেকে বেশ কিছু ক্ষেত্রে।,,,
,"২০ তিনি যখন এসব কথা চিন্তা করছেন , তখন প্রভুর এক দূত স্বপ্নে তাঁকে দেখা দিয়ে বললেন , "" য়োষেফ , দায়ূদের সন্তান , মরিয়মকে তোমার স্ত্রীরূপে গ্রহণ করতে ভয় করো না , কারণ তার গর্ভে য়ে সন্তান এসেছে , তা পবিত্র আত্মার শক্তিতেই হয়েছে ।",,,
,তাঁর অজস্র কবিতায় ধূমল কুয়াসাচ্ছন্ন হেমন্ত প্রকৃতি অন্তরঙ্গ অনুভবের সংশ্লিষ্টতায় অপূর্ব বাণীমূর্তি রূপে উদ্ভাসিত হয়েছে ।,,,
,- কিন্তু তাহা কিরূপে হইবে ?,,,
,"রুশনারা আলী, টিউলিপ রেজওয়ানা সিদ্দিক ও রূপা আশা হক।",,,
,উত্তর হাওড়া বিধানসভা কেন্দ্রের বিজেপিপ্রার্থী রূপা গত ২৫ এপ্রিল ভোটগ্রহণ পর্বের সময় তাঁর কেন্দ্রের অন্তর্গত শ্রীকৃষ্ণ সেবাশ্রম শিক্ষা নিকেতন ( প্রাথমিক ) বুথের বাইরে তৃণমূলকর্মীদের সঙ্গে বচসায় জড়িয়েছিলেন ।,,,
,আপনিতো বঙ্গবন্ধুকন্যা বলেই জাতি আপনাকে অনেক বড় চিন্তা - চেতনার ধারক - বাহক - লালনকারী রূপে দেখতে চায় ।,,,
,"জ্ঞান তাপস ভাষাবিদ ডঃ মোহাম্মদ শহীদুল্লাহ ইহার প্রতিবাদে বলেন , ' যদি বিদেশী ভাষা বলিয়া ইংরেজী ভাষা পরিত্যক্ত হয় , তবে বাংলাকে পাকিস্তানের রাষ্ট্র ভাষারূপে গ্রহণ না করার কোন যুক্তি নাই ।",,,
,২০০৭ সালে আর্সেনাল ছেড়ে বার্সেলোনায় যাওয়ার পর থেকেই আর অঁরিকে ঠিক অঁরি রূপে দেখা যায়নি।,,,
,"শুধু গান নয় , মিউজিক ভিডিও রূপে দর্শক - শ্রোতাদের সামনে এসেছে গানটি ।",,,
,"ধরা যাক উড়োজাহাজের কথাই , গত শতাব্দীর প্রথম দশকে সেই রাইটভাতৃদ্বয়ের উদ্ভাবিত রূপটি বদলাতে বদলাতে আজকে যে - রূপ ধারণ করেছে তা অবিশ্বাস্য ।",,,
,"সকলেই "" বিদ্রূপটা সবাই দেখতে পাচ্ছে ।",,,
,যা শুনে বেজায় ক্ষেপে যান রাজ্যসভায় মনোনীত সাংসদ রূপা ।,,,
,আর রঙিন জীবনের অধিকারী সঞ্জয় দত্তকে দারুণ সাবলীলভাবে ফুটিয়ে তুলে ক্যারিয়ারের সেরা অভিনয় উপহার দিয়েছেন রণবীর কাপুর আর নিজেকে সঞ্জয় দত্ত রূপে পর্দায় ফুটিয়ে তোলার জন্য . . .,,,
,"বলা বাহুল্য যে , এই সময়ই তাহাকে দৃঢ়রূপে ধরিয়া ফেলিতে হইবে , অন্যথায় সে পড়িয়া গিয়া কোনরূপ আঘাত পাইতে পারে ।",,,
,নীলফামারীর ডোমারে শাহিদা বেগম রূপা ( ৩২ ) নামের এক নারী মাদক ব্যবসায়ীকে আবারো গ্রেপ্তার করেছে পুলিশ ।,,,
,"ঢাকায় বাতাসের গতিবেগ দক্ষিণ ও দক্ষিণ - পূর্ব দিক থেকে ঘন্টায় ১০ - ১৫ কিলোমিটার , যা উত্তর ও উত্তর - পশ্চিম দিক থেকে অস্থায়ীভাবে দমকা হাওয়ারূপে ঘন্টায় ২৫ থেকে ৩৫ কিলোমিটার ।",,,
,"জয়ললিতার রূপে সেজে উঠছেন কঙ্গনা , রইল তার ঝলক",,,
,"আর যদি একজন পুরুষ ও দুইজন স্ত্রীলোককে সাক্ষীরূপে আনে এবং তারা সাক্ষ্য দেয় যে , যার উপর অপবাদ দেয়া হচ্ছে সে গোলাম তবে অপবাদ কারীর উপর হতে শাস্তি বাতিল হয়ে যাবে ।",,,
,আধুনিকতার ঝঞ্ঝা বা সমাজ থেকে বিছিন্ন শিক্ষাও জীবন শিক্ষার এই প্রয়োগগুলিকে পুরোপুরি রূপে নষ্ট করতে পারেনি ।,,,
,তার রূপই বা কেমন ?,,,
,সে কারণেই হয়তো মৌসুম-প্রস্তুতিতে ঠিক চেনা রূপে দেখা ছিল না স্প্যানিশ-জায়ান্টরা।,,,
,"পাল্টা রূপা বলেছেন , প্রকৃত ঘটনা জানার জন্য তদন্ত কমিটি গড়া হোক ।",,,
,এর পরে সিনেমার পরিচলাক রূপে খবরে এলেও রাজনীতির ময়দানে শঙ্কুদেবের হাঁটাচলা ছিল না দীর্ঘ সময় ।,,,
,বর্ণের সংক্ষিপ্ত রূপ ; কার ও ফলা : প্রতিটি স্বরবর্ণ ও কিছু কিছু ব্যঞ্জনবর্ণ দুটো রূপে ব্যবহৃত হয় ।,,,
,ওদিকে জি বাংলা - র অনুষ্ঠানে মহিষাসুরমর্দিনী রূপে দেখা যাবে ' করুণাময়ী রাণী রাসমণি ' - অভিনেত্রী দিতিপ্রিয়া রায়কে ।,,,
,"' ব্লোফেল্ড ' ছিল ' ক্যাসিনো রয়্যাল ' এ , ' ব্লোফেল্ড ' ছিল ' কোয়ান্টাম অফ সোলেস ' এ , ' ব্লোফেল্ড ' ছিল ' স্কাইফল ' এ এবং অবশেষে ' ব্লোফেল্ড ' এর পুর্ণাঙ্গ রূপে আবির্ভাব ঘটেছে ' স্পেক্ট্রা ' তে ।",,,
,আইপিএলে এক ম্যাচ খেলে অলস সময় কাটানো মোস্তাফিজ দ্রুত নিজের ‘ফিজ’ রূপে ফিরবেন নিশ্চয়ই।,,,
,সাকার রূপে এরূপ লিঙ্গ শরীর বা চিহ্ন আমরা সর্বত্রই ব্যবহার করি ।,,,
,"সেই চিরচেনা গল্প কিন্তু নতুন রূপে , আমরা ছোটবেলায় রোবোকপ দেখেননি এমন মানুষ খুঁজে পাওয়া দায় ।",,,
,তবে শুধুমাত্র রূপে আপনাদের ভোলানো সহজ নয় ।,,,
,লন্ডনের ইলিং সেন্ট্রাল অ্যান্ড অ্যাকটন আসনে দ্বিতীয় মেয়াদে ব্রিটিশ পার্লামেন্ট সদস্য হিসেবে নির্বাচিত হয়েছেন বাংলাদেশি বংশোদ্ভূত রূপা হক।,,,
,"শাস্ত্রদর্শী কোন পাঠক হয়তো এখনও বলিবেন - "" কিন্তু তোমার কথা মানি কিরূপে ?",,,
,কিন্তু রণমূর্তি রূপা গঙ্গোপাধ্যায় ডেপুটি চেয়ারম্যানের দিকে পাল্টা আঙুল উঁচিয়ে আরও তেতে ওঠেন ।,,,
,নিজ দেশের মুদ্রাভান্ডার ও বিশ্বব্যাংকের প্রতিনিধিরূপে কাজ করে।,,,
,"সংগীতের আবহাওয়া বদলায়, কিন্তু সংগীত নানা ধারায়, নানা রূপে চলতে থাকে।",,,
,"নাবী সাল্লাল্লাহু আলাইহি ওয়াসাল্লাম বললেনঃ হ্যাঁ , তাহলে সেরূপই ।",,,
,তিনটি খণ্ডিকার বিভক্ত মাত্রলক্ষণ সূত্র ' নামক সংক্ষিপ্ত রচনায় মন্ত্রের অক্ষরসমূহের দৈর্ঘ্য আলোচিত হয়েছে ; সহায়ক শ্রৌতসূত্র অপেক্ষা একে প্রাতিশাখ্য রূপে গ্ৰহণ করাই সমীচীন ।,,,
,""" রাজ্য বিজেপি দফতর , ৬ মুরলীধর সেন লেনে ওই ভাঁইফোটার আয়োজন করা হবে বলে জানিয়েছেন রূপা ।",,,
,উক্ত যোগটিই মানুষকে চলচ্চিত্র জগতের সঙ্গে সম্বন্ধ স্থাপন করায় গায়িকা রূপে লতার ক্ষেত্রে যা ঘটেছে ।,,,
,সেই জন্য বিমানবন্দর কর্তৃপক্ষ বিমানবন্দরকে সম্পূর্ণ নতুন রূপে সাজানোর সিদ্ধান্ত নেন এবং তাতে কলকাতা বিমানবন্দরের চেহারাটাই পাল্টে যায় ।,,,
,সন্ধ্যা - গোধূলির রাঙা রূপে ভুলে,,,
,এছাড়া লন্ডনের ইলিং সেন্ট্রাল অ্যান্ড অ্যাকটন আসনে দ্বিতীয় মেয়াদে ব্রিটিশ পার্লামেন্ট সদস্য হিসেবে নির্বাচিত হয়েছেন বাংলাদেশি বংশোদ্ভূত রূপা হক ।,,,
,"ফাইনালে প্রথম তিনের বিদায়ের পর শ্রীলঙ্কা যখন শুধুই তাঁর দিকে তাকিয়ে, তখনই দেখা দিলেন জয়াবর্ধনীয় রূপে।",,,
,শ্রাবন্তীকে এর আগে অপর্ণা সেনের ' গয়নার বাক্স ' ছবিতে গ্ল্যামারহীন রূপে দেখা গেলেও দেবের এই নয়া অবতার প্রথমবার ।,,,
,"সমাবেশে আরও বক্তব্য দেন জাতীয় মানবাধিকার কমিশনের সদস্য নিরূপা দেওয়ান, বাংলাদেশ আদিবাসী ফোরামের পার্বত্য চট্টগ্রাম শাখার সভাপতি প্রকৃতি রঞ্জন চাকমা, এমএন লারমা মেমোরিয়াল ফাউন্ডেশনের সভাপতি বিজয় কেতন চাকমা, আইজনীবী সুস্মিতা চাকমা, ব্লাস্টের রাঙামাটি জেলা সমন্বয়কারী জুয়েল দেওয়ান প্রমুখ।",,,
,তাঁরা পূজিতা হন আদি শক্তি রূপে ।,,,
,হামিদার রূপে পাগল হয়ে সে যে হামিদাকে বিয়ে করতে চাচ্ছে তা কিন্তু না ।,,,
,নিজের কাছে নিজের বারবার খোলস বদলাই কখনো নারীর এইরূপে নয় বহুরূপে . . .,,,
,"দ্যুতি বলছেন , "" কাজাখস্তানের ফাইনাল রাউন্ডে রূপো জিতেছিলাম ১১ . ২৪ সেকেন্ড সময় করে ।",,,
,"ফলে , কাহিনিগুলির একাধিক রূপও দেখা যায় ।",,,
,সনাতন ধর্মাবলম্বীদের প্রধান ধর্মীয় উৎসব শারদীয় দুর্গোৎসবের ষষ্ঠীতে দেবীদুর্গা শ্বশুরবাড়ি কৈলাস থেকে কন্যারূপে বাপের বাড়ি বেড়াতে মর্ত্যলোকে আসেন ।,,,
,"তুলসী বলে , তিনি নারায়ণকে স্বামীরূপে পেতে চান ।",,,
,এরপর আমরা এক শিশুরূপে তোমাদের বের করি - ফলে ( পরবর্তীতে ) তোমরা তোমাদের পরিপক্ক বয়সে পৌঁছে যাও ।,,,
,ক ) রূপে তার যেন এত ভয়,,,
,রুদোকের ভ্ৰাতা ভীম জনপ্রিয় নরপতি ছিলেন এবং তার আমলে উত্তরবঙ্গের এই কৈবৰ্তরাজ্য এক সুপ্রতিষ্ঠিত এবং পরাক্রমশালী শক্তিরূপে পরিগণিত হয় ।,,,
,পরবর্তীকালে চন্দ্রের গতি ও নক্ষত্র এই কাজে সহায়ক উপায়রূপে দেখা দেয় ।,,,
,"নারীদের যদি চিত্রিত করা হয় আরাধনাকারী ম্যান্টিস , ম্যানড্রেক , দানবীরূপে , তাহলে তাদের মধ্যে কাব্যদেবী , দেবী মহামাতা , বিয়াত্রিসেকেও পাওয়া খুবই গোলমেলে ব্যাপার ।",,,
,আমি তোমাকে সত্যসহ শুভ সংবাদ দাতা এবং সতর্ককারী রূপে প্রেরণ করেছি ।,,,
,তিনি মেথড অফ এক্সহশন ব্যবহার করে অসীম ধারার সমষ্টিরূপে প্যারাবোলার বক্ররেখার অন্তগর্ত ক্ষেত্রের ক্ষেত্রফল নির্ণয় করেন এবং পাই - এর প্রায় নিখুঁত একটি মান নির্নয় করেন ।,,,
,কিরূপে আমি দীর্ঘ পরমায়ুঃ প্রাপ্ত হই তাহার উপায় বলিয়া দেন ।,,,
