lemma,sentence,sense,start,end
,বাল্মীকিপ্রতিভা ও কালমৃগয়া এই দুই ক্ষেত্রেই নাট্যের গতিকে সুচারু রূপে এগিয়ে নিতে সাহায্য করে সঙ্গীত ।,,,
,সোমবার রাজভবন থেকে বেরিয়ে আসছেন বিজেপি সদস্য রূপা গঙ্গোপাধ্যায় ।,,,
,"একই সঙ্গে ব্রিটিশ পার্লামেন্টের সদস্য নির্বাচিত হওয়ায় বাংলাদেশি বংশোদ্ভূত রুশনারা আলী, টিউলিপ সিদ্দিক ও রূপা হককে অভিনন্দন জানায় ১৪ দল, দেশে এলে তাঁদেরও সংবর্ধনা দেবে।",,,
,"স্ত্রীকে মাতারূপে ভগ্নীরূপে , প্রিয়ারূপে দেখলে পুরুষের বড় সুখ হয় ।",,,
,দীর্ঘ পঁচিশ বছর ধরে অর্ধ - পৃথিবীর অধীশ্বর কুবলাই খাঁ - র বিশ্বস্ত কর্মচারীরূপে প্রায় সমস্ত চিন তিনি পর্যটন করে ফিরেছেন ।,,,
,• চামুণ্ডাঃ মহামায়ার এই বিনাশিকা রূপটির নামও রাখা হয় না ভারতীয় সমাজে ।,,,
,( ৮ ) সাক্ষাৎ সম্বন্ধে না হইলেও তিনিই যে উক্ত ছয়রূপে বিলাস করেন তাহার বিচার করিতেছি ।,,,
,বর্তমানে তিনি বিধায়ক ও সাংসদে কোনও পদে না থাকলেও দক্ষ সংগঠক রূপে প্রচুর সুনাম রয়েছে তাঁর রাজনৈতিক মহলে ।,,,
,তাঁকে দেখা যাবে অন্য রূপে।,,,
,ভেদ শুধু নাম রূপে ।,,,
,"এই উন্মুক্ত মূল্যবোধ সংযোগের জগতে তাই সংশ্লিষ্ট ব্লগ পোস্টকর্তার প্রকাশিত পোস্ট এবং মন্তব্যে লিখিত , অডিও , ভিডিও কিংবা ছবি অথবা অন্যকোনো রূপে বা আকারে যাবতীয় তথ্যাদির স্বত্ব লেখক কর্তৃক সংরক্ষিত থাকবে ।",,,
,"কিরূপে বাক্সটী থানায় আসিয়া উপস্থিত হইল , কিরূপ সন্দেহের উপর নির্ভর করিয়া উহার দড়ি খুলিয়া ফেলা হইল , ও বাক্সের চাবি ভাঙ্গিয়া ফেলা হইল , প্রথমে তাহাই জানিবার প্রয়োজন বিবেচনা করিয়া একজন ঊর্ধ্বতন কর্মচারী জিজ্ঞাসা করিলেন , কোন কর্মচারীর সম্মুখে এই বাক্সটী প্রথম থানার ভিতর আনীত হয় ?",,,
,"রামজীলাল যখন বাঙ্গালা ভাষা একবারেই অবগত নহেন , তখন তিনি বাঙ্গালা ভাষায় আপনার নাম কিরূপে স্বাক্ষর করিলেন , তাহার কিছুই বুঝি উঠিতে পারিলাম না ।",,,
,এমনকি ডিম্বাণু সক্রিয় নীতিরূপে গৃহীত হওয়ার পরও পুরুষেরা এর শান্ততার বিপরীতে শুক্রাণুর সজীব গতিশীলতাকে গুরুত্বপূর্ণ বলে মনে করেছে ।,,,
,"আগামী ৫ বছরেই সম্পূর্ণ রূপে কার্যকর হতে চলেছে এই সিদ্ধান্তে , ই - যানবাহন কেনার ক্ষেত্রে কোনও নির্দিষ্ট লক্ষ বেঁধে দেওয়া হচ্ছে না ।",,,
,"এটা অবশ্যই এক বিরাট সাফল্য এবং ২০০৮ সালের নভেম্বর মাসে কমিশান আইন মন্ত্রককে ' টোটালাইজার ' যন্ত্রটির ব্যবহার এবং সেই সংক্রান্ত আইন সংশোধন করতে অনুরোধ করে চিঠি লেখে , যাতে অন্তত ঐচ্ছিক রূপে হলেও এটি ব্যবহার হয় ।",,,
,"মমতা যখন নোট বাতিল ইস্যুতে ভারত পরিক্রমা করে নজর কাড়তে ব্যস্ত , তখন রাজ্যে মুখ্যমন্ত্রী তথা স্বাস্থ্যমন্ত্রীকে বিঁধতে ছাড়লেন না বিজেপি রাজ্য সভাপতি দিলীপ ঘোষ , রূপা গঙ্গোপাধ্যায় - রা ।",,,
,"তিতাসের পশ্চিমপারে ছায়াঢাকা শ্যামল , শান্ত ছবির মতো গ্রামটি ; দক্ষিণে ফসলের মাঠ , প্রতি ঋতুতে নতুন রূপে সাজে গ্রামটি ; বর্ষায় অনন্য রূপে সাজে অনন্তপুর ; মনে হয় যেন জলের ওপর ভাসছে একটি সবুজ গ্রাম . . . জলেঢাকা ফসলের মাঠে ফোটে শাপলা , শালুকের পানা ভেসে থাকে পানির ওপর ছাতার মতো ছড়িয়েছিটিয়ে ; মাছের আনোগোনা বেড়ে যায় , সাপ - ব্যাঙসহ আরো কত যে জলজ প্রাণি .",,,
,ঘরকে একটু বৈশাখী রূপে সাজাতে চেষ্টা করুন ।,,,
,"ঘরে যখন ফিরল রূপা লাগল তাহার মনে ,",,,
,"হুঁকো , বং , পাইপ , থেকে চুরুট , সিগারেট , বিড়ি . . . নানা রূপে তামাকের ধোঁয়া মানুষকে আচ্ছন্ন করে রেখেছে ।",,,
,লন্ডনের ইলিং সেন্ট্রাল অ্যান্ড অ্যাকটন আসন থেকে প্রার্থী হয়ে গতবার মাত্র ২৭৪ ভোটে জেতা টিউলিপের মতোই প্রথম পার্লামেন্ট সদস্য হয়েছিলেন কেমব্রিজের ডিগ্রিধারী রূপা ।,,,
,"' দ্য রেভেন ' বা ' দাঁড়কাক ' কবিতাটি রোম্যান্টিকতা , মোহন সুরেলা ছন্দোময়তা ও তার রহস্যময় পরিমণ্ডলের জন্য বিশ্বের অন্যতম শ্রেষ্ঠ কবিতারূপে স্বীকৃতি লাভ করেছে ।",,,
,অনেক বেছে তবে উত্তর হাওড়ায় প্রার্থী হয়েছেন রূপা ।,,,
,"মনে রাখা দরকার , গণতান্ত্রিক এবং নাগরিক মূল্যবোধে আমেরিকান নেতাদের বাণী সারা দুনিয়ায় আদর্শ রূপে গৃহীত হয়ে আসছে ।",,,
,সালে ' উৎসর্গ ' এবং ' এখানে আকাশ নীল ' ছবি দুটির মাধ্যমে খলিল চরিত্রাভিনেতা রূপে আত্মপ্রকাশ করেন ।,,,
,( ২ ) ' উভয় সম্বন্ধ ' - প্রকৃতি তাঁহাতে এবং তিনি অন্তর্য্যামিরূপে প্রকৃতিতে ।,,,
,"এখন প্রশ্ন আসে, দারবিশকে আমরা কী-রূপে পাঠ ও বিবেচনা করব?",,,
,রূপে - গুণে - অভিনয়ে সুস্মিতা সেন ' হার্টথ্রব ' ।,,,
,আরও ঘনিষ্ঠ রূপে দেখেছি !,,,
,পরবর্তীতে এমপি সেলিম ওসমান বিকেএমইএ সৃষ্টির মাধ্যমে নারায়ণগঞ্জের হোসিয়ারী শিল্পকে বৃহৎ আকার দিয়ে হোসিয়ারী পন্যকে নীটপন্য রূপে বিদেশে রপ্তানি শুরু করেন ।,,,
,এটি এমন একটি রোগ যা নানাভাবে নানারূপে আমাদের দেহে বাসা বাঁধতে পারে ।,,,
,মাতৃরূপে দেবী সংস্কৃতির ধারণা অতি প্রাচীন।,,,
,একের পর সুপারহিট ছবিতে অভিনয় করছেন কখনও খলনায়ক বা কমেডিয়ান রূপে সবার মন জয় করছেন ।,,,
,"সব মিলিয়ে শান্তিনিকেতনের শুদ্ধতম , নির্মল রূপটি তার সমস্ত অপরূপা প্রকৃতি নিয়ে বইপড়ুয়ার মনে চিরন্তনীর চিহ্ন এঁকে দিয়ে যায় ।",,,
,এই সময় খ্রা - দ্গে - স্লোং - ত্শুল - খ্রিম্স - দার - র্গ্যাস ( ওয়াইলিঃ khra dge slong tshul khrims dar rgyas ) নামক বৌদ্ধ সাধিকা তাঁকে দ্পাল - স্প্রুল - ও - র্গ্যান - ' জিগ্স - মেদ - ছোস - ক্যি - দ্বাং - পো ( ওয়াইলিঃ dpal sprul o rgyan ' jigs med chos kyi dbang po ) নামক লামার পুনর্জন্ম রূপে চিহ্নিত করেন ।,,,
,"ক্রিয়াপদের বললো - করলো - হাসলো - গাইল রূপটি "" ভবিষ্যতের ভার "" গল্পের শুরুতে ব্যবহার করা হয়েছে ।",,,
,শ্বশুড়বাড়ি থাকাকালীন তারা স্বামী-স্ত্রীরূপে থাকার অধিকার পেত ।,,,
,চক্ষু দানের মাধ্যমেই মৃন্ময়ী থেকে চিন্ময়ী রূপে প্রতিষ্ঠিত হন মা দূর্গা ।,,,
,দাবাপৃথ্বীকে যদি মিথুন রূপে গণ্য করা হয় তাহলে মহাকাশে অবস্থিত সূর্য এবং পৃথিবীকে মিথুনরূপে গ্রহণ করতে বাধা কোথায় ?,,,
,"স্মারকলিপি প্রদানকালে উপস্থিত ছিলেন - এনসিটিএফ জেলা সভাপতি মো . শাহীন , সাধারণ সম্পাদক আবু তৈয়ব রুবেল , শিশু সাংবাদিক মো . জুয়েল , শিশু গবেষক সাবরিনা সিফাত , ফারজানা রূপা , চাইল্ড পার্লামেন্টের মেম্বার ( ছেলে ) সাঈদ বিন আল হোসাইন হৃদয় , চাইল্ড পার্লামেন্টের ( মেয়ে ) তানজিনা আলম ঝুমু , শিশু সাংবাদিক ( মেয়ে ) লামিয়া আকতার , ডিস্ট্রিক্ট ভলেন্টিয়ার মরিয়ম আমিন ফেন্সিসহ প্রমুখ ।",,,
,তাঁদের স্ত্রী - কন্যা - মা - ভগ্নীদের বন্দী করে তাঁদেরকে রূপান্তরিত করছে যৌনদাসীরূপে ।,,,
,হৃদয় হরণ করা এমন রূপে বারবার হাতছানি দেয় চট্টগ্রামের সীতাকুণ্ডের অনিন্দ্যসুন্দর গুলিয়াখালি সমুদ্র সৈকত ।,,,
,"পুজোর মেলা , বৈশাখি মেলা , চৈত্র - সংক্রান্তির মেলা , ঈদের মেলা , মধু মেলা আরো কতশত মেলা আজো রয়ে গেছে সেই চীরচেনা রূপে ।",,,
,"কিনা , আমি বুঝি মনে মনে ছোটভাইয়ের স্ত্রীর রূপে পাগল হয়ে গেছি ।",,,
,নানাবিধ ভৈষজ্য দ্বারা হৃদয়ের স্বাভাবিক তাল বিভিন্ন রূপে পরিবর্ত্তিত হয় ।,,,
,তখন থেকেই ওই দুজনের নজরে ছিল রূপা ।,,,
,সামাজিক রীতি অনুসারে মদ পান করে স্বামী - স্ত্রীরূপে স্বীকৃতি অর্জন করে ।,,,
,এবার এক নাটকে তিন রূপে হাজির হচ্ছেন টিভি অভিনেতা সজল।,,,
,কলকাতাঃ গুরুত্বর অসুস্থ অবস্থায় সল্টলেকের একটি বেসরকারি হাসপাতালে ভর্তি বিজেপি সাংসদ ও অভিনেত্রী রূপা গাঙ্গুলি ।,,,
,"রাবী সুফ্ইয়ান বলেন , আ ' মাশ এ হাদীস মারফূ ' রূপে বর্ণনা করেননি ।",,,
,"ঝাড়গ্রাম রাজ কলেজের শারীরবিদ্যা বিভাগের তৃতীয় বর্ষের ছাত্রী তথা কলেজ ছাত্র সংসদের সহ - সভানেত্রী অনুরূপা ঘোষ বলেন , "" প্রকল্পটি বাস্তবায়িত হলে নতুন জেলার প্রত্যন্ত এলাকার পড়ুয়ারা জেলাতেই স্নাতকোত্তর শিক্ষার সুযোগ পাবেন ।",,,
,"যদি হয় , তবে প্রত্যেক দেহে তাহাদের পার্থিব দেহের সম্পূর্ণ পদার্থ বিদ্যমান থাকিবে কিরূপে ?",,,
,"রূপা বললেন , "" পুরোপুরি মিল তো সম্ভব নয় ।",,,
,"জুয়েলারী আবার যে সে নয় , ডায়মন্ডের সঙ্গে রূপো কম্বিনেশনে একটি আম্রপালি ঝুমকোর সেট দিতে চলেছেন ।",,,
,", ২ ) কুসংস্কারের ভীত অক্ষত রয়ে যাচ্ছে প্রথার রূপে ।",,,
,সমস্ত স্থানটা গোবরমাটি দিয়া অতি পরিপাটীরূপে নিকাইয়া ফেলা হইয়াছে ।,,,
,বাংলা ভাষা বাংলাদেশের শিক্ষাব্যবস্থায় গুরুত্ব হারাচ্ছে এবং রাষ্ট্রভাষা রূপে পূর্ণ প্রতিষ্ঠা পাচ্ছে না ।,,,
,সার্বিক রূপে যন্ত্রের নির্মাণপদ্ধতি ও ধাতুচ্ছেদক প্রক্রিয়া শেখানোর জন্য পাঠ্যপুস্তকও তাঁর লেখা ।,,,
,"দিলীপবাবু , প্রাক্তন বিধায়ক শমীক ভট্টাচার্য , রাজ্যসভা সাংসদ রূপা গঙ্গোপাধ্যায় , দলীয় সম্পাদক লকেট চট্টোপাধ্যায় - সহ বিজেপি - র নেতা - কর্মীরা মিছিলের শেষে সমাবেশ করে মুখ্যমন্ত্রীর কুশপুতুলও পোড়ান ।",,,
,"নিজেকে কোন রূপে মানায় , তা বেশ বোঝেন ।",,,
,"এক্ষণে জয়নাবলাভে বঞ্চিত হইয়া শত্রুভাব সহস্রগুণে এজিদের অন্তরে দৃঢ়রূপে স্থায়ী হইয়াছে , তাহাও জয়নাবকে বলিতেন ।",,,
,"অনাবিল সেনগুপ্ত : ' বণিকের মানদণ্ড পোহালে শর্বরী , দেখা দিল রাজদণ্ড রূপে ' ।",,,
,"অতএব , তোমরা কিরূপে আত্নরক্ষা করবে যদি তোমরা সেদিনকে অস্বীকার কর , যেদিন বালককে করে দিব বৃদ্ধ ?",,,
,এ সময় আহত হয়েছে রূপা চক্রবর্তী ( ১০ ) নামে আরেক শিক্ষার্থী ।,,,
,রূপা আবারো হাসল ।,,,
,"নোবেল ফাউন্ডেশন তার এই কাব্যগ্রন্থটিকে বর্ণনা করেছিল একটি ' গভীরভাবে সংবেদনশীল , উজ্জ্বল ও সুন্দর কাব্যগ্রন্থ ' রূপে ।",,,
,এ সময় সে মুসলমানদের সব অবস্থা ও মদিনার পরিস্থিতি উত্তম রূপে অবগত হতে পারে ।,,,
,"রবীন্দ্রনাথ , বঙ্কিমের পাশাপাশি আলোচনা করতেন অনুরূপা , নিরুপমা , সীতা ও গিরিবালা দেবীর মতো মেয়েদের লেখা নিয়ে ।",,,
,আরও পড়ুনঃ চেনা বিপাশা এবার অচেনা রূপে,,,
,"আধুনিক যুগের সময়টা আমাদের কতটা তার বেড়িবাঁধে ঘ্রাস করে নিচ্ছে , তার আলোকচিত্র রূপে ফুটে উঠেছে প্রধান চরিত্রের আলোকে রচিত নাটকটির গল্পকথা ।",,,
,"বাতাসিয়া লুপ থেকে কাঞ্চনজঙ্ঘার সৌন্দর্য্য আপনার চোখে ধরা দেবে অন্য একটা রূপে , এখানে পনেরো রূপি দিয়ে এন্ট্রি টিকেট নিতে হয় ।",,,
,ছেলের দুর্ঘটনার খবর জানিয়ে অবশ্য রূপা গঙ্গোপাধ্যায়ও একটি টুইট করেন ।,,,
,বিজেপির মহিলা মোর্চা সভাপতি রূপা গঙ্গোপাধ্যায় এবার হাওড়া উত্তর কেন্দ্রে প্রার্থী হয়েছেন ।,,,
,"এ ছাড়াও বাঙালিত্বের গৌরবগাথার স্মারক এই নববর্ষের অনুষ্ঠানে সম্মেলক ও একককণ্ঠে গাওয়া হবে ' আনন্দধ্বনি জাগাও গগনে ' , ' ওরে বিষম দরিয়ার ঢেউ ' , ' তোরা সব জয়ধ্বনি কর ' , ' ভোরের হাওয়ায় এলে ঘুম ভাঙাতে ' , ' একি অপরূপ রূপে মা তোমায় হেরিনু পল্লী জননী ' ও ' উদয়শিখরে জাগে মাভৈ মাভৈ ' সহ মোট ২৪টি গান ।",,,
,বর্তমান রূপে সড়ক পরিবহন বিল পাস নয়,,,
,আপনার নাম রূপা,,,
,"সময় সাথে সাথে আগ্রাসনের রূপ পরিবর্তন করে রাইফেল , বুলেট আজ রূপসী শিলার যৌবন মাখা নরম ঠোঁট রূপে হাজির হয়েছে আমার কাছে ।",,,
,দুই প্রতবেশী কন্যা রূপা ও নাসরিন ।,,,
,"ইসলাম ধর্ম বা মুসলিম সমাজ কতটা উন্নত সেসব দলিলের বোঝা মাথায় বহন করে ঘুরে বেড়ানোর মধ্যে কোনো সার্থকতা অর্জিত হবে না , বরং প্রকৃত সার্থকতা অর্জিত হবে আমাদের সমাজের মূল্যবোধ ও মানবতার উৎকর্ষ রূপটি জগদ্বাসীর সামনে তুলে ধরার মাধ্যমে ।",,,
,নীলফামারীতে দলীয় ম্যানেজার সত্যজিত দাস রূপু দলকে রেখে চলে এসেছিলেন ।,,,
,আমাদের জীবনে একমাত্র সাধনা বাংলা ভাষার মূমুর্ষূ রূপে লাবণ্যের প্লাবণ আনা ।,,,
,বিষ্ণুর স্ত্রী হিসাবে লক্ষ্মীদেবী যোগমায়া রূপে প্রসিদ্ধা ।,,,
,মাথার চুল কামিয়ে তা ওজন করে সমপরিমাণ স্বর্ণ অথবা রূপা অথবা তার সমতুল্য মূল্য সাদাকাহ করে দিতে হবে ।,,,
,"অতীতে অনেকবার দীর্ঘ সময় ধরে রাজস্থানের বর্তমান মরু অঞ্চলে সমুদ্র বিরাজ করেছে l সার্মো কার্বোনিফেরাস ভূতাত্ত্বিক যুগে পশ্চিম যোধপুর ও জয়সলমের অঞ্চল পুরোপুরি সমুদ্রের তলায় ছিল l ক্রিটাসিয়াম যুগের শুরুতে সমুদ্র পিছিয়ে গেলেও মধ্য পর্বে আবার তা এগিয়ে আসে এবং পরিশেষে মায়োসিন ও প্লায়োসিন যুগে স্থায়ীভাবে পিছিয়ে যায় l মরুভূমির অধিকাংশ বৈশিষ্ট্যই অর্জিত হয়েছে তারও পরে , প্লায়োস্টাসিন তুষার যুগের সমাপ্তির পর l কয়েক কোটি বছর আগেকার অবক্ষেপণ ও বিশেষ ধরনের মাটি ও ভূমিরূপই র্নিভুলভাবে জানিয়ে দেয় , সেই সময়ে মরুভূমির বদলে এই অঞ্চলে ছিল দিগন্তবিসারী সমুদ্র l",,,
,"মালিনী তাহার আসনের তলদেশ হইতে এক মুঠি রূপা ও তামার মুদ্রা লইয়া হিসাব করিয়া অর্জুনকে ফেরত দিল , বলিল - গুনে নাও ।",,,
