lemma,sentence,sense,start,end
কাটা,এক দেড় বৎসর আগে থেকে হাজীগাঁও ও মোহাম্মদপুর এলাকায় পাহাড় কাটা বন্ধ হলেও বন্দর এলাকায় এখনও পাহাড় কাটার মহোৎসব চলছে ।,1,101,105
কাটা,মাসখানেক আগে গ্রামের একটি বড়ইগাছ কাটাকে কেন্দ্র করে বাগল মিয়ার সঙ্গে খালেক মিয়ার আবারও ঝগড়া হয় ।,1,34,38
কাটা,চাইনিজ ছেলেরা ইউরোপ - আমেরিকায় আসার আগে একটা চুল কাটার মেশিন নিয়ে আসে ।,1,50,54
কাটা,এর আগে সকালে সোনারগাঁ উপজেলার জামপুর ইউনিয়নের মুছারচর গ্রামে বাড়ির পাশের খেতে ধান কাটার সময় ওবায়দুল (৩০) নামের এক কৃষক মারা গেছেন।,1,82,86
কাটা,আগে তিন মাস আগে টিকিট কাটার সুবিধা ছিল ।,1,22,26
কাটা,কৃষকরা চৈত্র মাসের তারিখের মধ্যে পাট রোপন করেন । আর পাট কাটার থেকে দিন আগে কোন রকম চাষ ছাড়ায় পাটের জমির মধ্যে আউশ বীজ ছিটিয়ে দেয় । আউশ ধান ঘন থাকলে পাট কাটার পর তুলে খালি স্থানে রোপন করা হয় এবং ঘাস পরিষ্কার করা হয় ।,1,56,60
কাটা,ফসল কাটার এক সপ্তাহ আগে শিমজাতীয় শস্য লাগানোর পদ্ধতিকে কী বলে?,1,4,8
কাটা,মাথা কাটার আগে তাদের শরীরে লাল রঙের ডোরা আঁকা হতো ।,1,5,9
কাটা,ধান কাটার এক সপ্তাহ আগে কালবৈশাখীতে সব শেষ।,1,4,8
কাটা,এই গাছ কাটার প্রতিবাদে এর আগে আদালতে আবেদন জানিয়েছিল একাধিক স্বেচ্ছাসেবী সংস্থা ।,1,7,11
কাটা,"এক দিন আগে দুর্গাপুর যাওয়ার জন্য শিয়ালদহ আসানসোল ইন্টারসিটি এক্সপ্রেসে টিকিট কাটার পর , নির্ধারিত দিনে ( ২২ ফেব্রুয়ারি ) ট্রেন ছাড়ার আধ ঘণ্টা আগে ব্যারাকপুর স্টেশনে পৌঁছে শোনা গেল , ট্রেনটির যাত্রাপথ পরিবর্তন করা হয়েছে এবং নির্ধারিত রুট ব্যারাকপুর - নৈহাটি না হয়ে ট্রেনটি দক্ষিণেশ্বর - ডানকুনি হয়ে যাবে ।",1,79,83
কাটা,"’মো. জালাল উদ্দিন আরও বলেন, ‘রাস্তার পাশ থেকে কোনো গাছ কাটার আগে আমাদের অবহিত করা উচিত ছিল।",1,55,59
কাটা,শুক্রবার ট্রেনে ওঠার আশায় দু ' দিন আগে থেকে টিকিট কাটার চেষ্টা করেও বিধি বাম ।,1,51,55
