lemma,sentence,sense,start,end
ডাক,"একটি পুনর্জাগরণের ডাক দেয়া দরকার , যা একমাত্র ' একাত্তরের ঘাতক দালাল নির্মূল কমিটি ' দিতে পারে ।",1,18,21
ডাক,ঢাকার মুক্তিযুদ্ধ জাদুঘরে সম্মিলিত সাংস্কৃতিক জোট আয়োজিত একটি গোলটেবিল আলোচনা থেকে ' পাঠ্যপুস্তকে সাম্প্রদায়িকীকরণ ও মুক্তিযুদ্ধের চেতনা পরিপন্থী পরিবর্তন প্রতিরোধে ' সারা দেশে বৃহত্তর শিক্ষা আন্দোলনেরও ডাক দেয়া হয়েছে ।,1,205,208
ডাক,জীবন বাজি রেখে সালে জাতির জনক বঙ্গবন্ধুর ডাকে সাড়া দিয়ে যুদ্ধ করে দেশকে হানাদার মুক্ত করেছেন ।,1,41,44
ডাক,"সেইসাথে এই বাংলার মানুষের জন্য আন্দোলনের ডাক দিয়ে বিভিন্ন মেয়াদের কারাবন্দি ছিলেন । """,1,41,44
ডাক,"মঙ্গলবার বিকালে রাজধানীতে মুক্তিযোদ্ধাদের এক আলোচনা সভায় তিনি বলেন , "" আমরা নিশ্চিত মৃত্যু জেনে মুক্তিযুদ্ধ করেছি , যার ডাকে মুক্তিযুদ্ধ করেছি স্বাধীনতার কয়েক বছরের মাথায় তাকে স্বপরিবারে হত্যা করা হয়েছে ।",1,121,124
ডাক,তাঁরা সারা দেশব্যাপী আন্দোলনের ডাক দিয়েছেন ।,1,31,34
ডাক,"তিনি তাঁর বক্তব্যে বলেন , জাতির জনক বঙ্গবন্ধু শেখ মুজিব সুখী সমৃদ্ধ বাংলাদেশ গড়ার স্বপ্ন নিয়ে পরাধীনতার হাত থেকে বাঙালি জাতিকে মুক্ত করার জন্য স্বাধীনতার ডাক দিয়েছিলেন ।",1,156,159
ডাক,"মুক্তিযুদ্ধ শুরু হওয়ার সময় তিনি পাকিস্তানের জাতীয় দলের ট্রায়ালে ডাক পান , কিন্তু সেদিকে না গিয়ে তিনি মুক্তিযুদ্ধে অংশ নেন ।",1,68,71
ডাক,কাউকে অনুরোধ করব সেই ভাষা আজ আমার কিংবা আমাদের নাই । মুক্তিযোদ্ধের সেই মহান শহীদ'দের মনে হয় আজ বিরোধী দলীয় নেত্রী ছোট করে ফেলেছেন । কারন উনার তো অজানা নয় ঊনার স্বামী স্বয়ং শেখ মুজিবর রহমানের আওয়ামী লীগের ডাকে সাড়া দিয়ে মহান মুক্তিযোদ্ধে অংশ নিয়েছিলেন ।,1,209,212
ডাক,* 15ইফেব্রেুায়ারী 1971 সালে জাতীয় পরষিদের ডাক দিলেন শেখ মুজিবুর রহমান প থেকে ।,1,44,47
ডাক,"স্বাধীনতার যে ডাক বঙ্গবন্ধু দিয়েছিলেন , তা বিদ্যুৎগতিতে সারা দেশে ছড়িয়ে পড়েছিল ।",1,14,17
ডাক,"আন্দোলনের ডাক দিয়ে ঘরে বসে থাকবেন , বিএনপির আন্দোলন মানেই বেগম জিয়ার ভ্যানিটি ব্যাগ ।",1,10,13
ডাক,"অন্যদিকে , গোটা সমীকরণটা বুঝে প্রথম থেকেই বিবেক ভোটের ডাক দিয়ে রেখেছেন প্রাক্তন স্পিকার মীরা কুমার ।",1,54,57
ডাক,মার্চ ঢাকার রেসকোর্সে বঙ্গবন্ধুর ঐতিহাসিক ভাষণে আসে মুক্তিযুদ্ধের ডাক ।,1,66,69
ডাক,"তা হলে তো কোনদিন বলে বসবি কাক কা-কা করে না , পাঁঠার মতো ভ্যাঁ-ভ্যাঁ করে ডাকে !",2,72,75
ডাক,বাড়িতে এসে কোনো কিছু না বলে সুলতানাকে ডাক দিলাম ।,2,39,42
ডাক,ডাক আবার শোনা যায় - চিই চিই চিই চিইহি চিই চিই চিই চিইহি ।,2,0,3
ডাক,আমার যত খারাপ দিনই যাক না কেন --- সামারার ঐ একটা ডাক আমাকে পুনরুজ্জীবিত করে দেয় ।,2,49,52
ডাক,"মাথা ঝাঁকাল রানা , চেহারা স্থির আর থমথমে , বলল , রাতে ওর যদি নাক ডাকে , শিস দিয়া , থেমে যাবে ।",2,65,68
ডাক,কে ডাকে আমায় এই নিশি রাতে ?,2,3,6
ডাক,"এখানে মাটিতে ছিলো কৃষকের ছায়া , এখানে পাখির ডাকে কত ছিলো মায়া !",2,45,48
ডাক,তাই সে শীতের ভোরে আমাদের কিচিরমিচির ডাক শুনে আমাদের আনন্দে আত্মহারা হয়ে যাওয়াটা দেখতে আসে ।,2,36,39
ডাক,"ধীর-স্থির-শান্ত-বিপাশার সঙ্গে সম্পূর্ণ স্বাভাবিকভাবে কথা বলে , তাকে আদর করে , বার বার অকারণে ডাকে – বিপাশা !",2,93,96
ডাক,ওই পাষণ্ডদের কানে তোর মা ডাক পৌঁছাত কি না তাতে যদিও সন্দেহ আছে আমার ।,2,25,28
ডাক,". তবে আজকাল আকাশ মেঘলা হলে খুব জোড়ে জোড়ে ঐ মেঘেদের মেঘ বলে ডাকি , ঐ মেঘেরা আমার ডাকে সাড়া দিয়ে অঝোর বর্ষণে ভিজিয়ে দেয় ।",2,61,64
ডাক,আমার ' আকাশ কেন ডাকে ' ' শাম মসতানি ' - র থেকে ভাল লাগে ।,2,16,19
ডাক,সেতু পাড় হয়ে উঁচুর দিকে হাঁটা শুরু করতেই কানে ভেসে আসল পাখির ডাক ।,2,63,66
ডাক,"চারিদিকে ঘুটঘুটে অন্ধকার , ঝিঁঝি পোকার ডাক , দূর থেকে ভেসে আসতে লাগলো শিয়ালের হুক্কাহুয়া , আনন্দ , ভয় চরম উত্তেজনায় ঘুমিয়ে পড়লো রিতু ।",2,39,42
ডাক,"বাবা মার ডাকে মেয়েটির নাম জানা গেলো , মেয়েটি রিমি ।",2,9,12
ডাক,দেহকে দুলিয়ে দুলিয়ে উড়ে অনেক উঁচুতে ওঠে এবং কর্কশ ডাকের মাধ্যমে সেক্রেটারি পাখি প্রণয় আচরণ প্রকাশ করে ।,2,53,56
ডাক,"শফিকের মন যেন কেমন কু ডাক দিচ্ছিলো , বার বার ড্রাইভার সাহেবকে অনুরোধ করছিলো একটু আস্তে চালাতে ।",2,22,25
ডাক,প্রজননকালে ময় – রীর ডাকে হৃদয়ে ভালবাসা নিয়ে ছুটে আসে একাধিক ময় – র ।,2,21,24
ডাক,"বাবাকে বলত , ' বাবা মাকে ডাকো , তুমি ডাকলে শুনবে , আমার ডাকে শোনে না , মনে হয় রাগ করেছে । '",2,25,28
ডাক,"কোলাব্যাঙ সোনাব্যাঙ ডাকে কট-কট-কটর , গ্যাঁগোঁ-কিরিকিরি ।",2,20,23
ডাক,সুরেলা শিস দিয়ে কেউ যেন আমাকে ডাকছে – অনেকটা নিশির ডাকের ' আমার বিছানার মাথার দিকে একটা জানলা আছে ।,2,52,55
ডাক,আমি মনে হয় সে রাতে ' সু ' ডাক শুনেছিলাম ।,2,27,30
ডাক,"কিছুটা পথ যখন হেটে গেলাম তখন পিছন থেকে ডাক দিয়ে বললো "" আমাকে দেখেও এমন করে চলে যাচ্ছিস কেন ?",2,39,42
ডাক,প্যাঁচার অদ্ভূত রকমের ডাক এবং নিশাচর স্বভাব একে নানা কুসংস্কার এবং অলৌকিক চিন্তার সাথে যুক্ত করেছে ।,2,22,25
ডাক,কোকিলের খাঁচার সামনে কুহু-কুহু করে ডাকে ।,2,35,38
ডাক,"দুপুরের খাবার খেতে বসলে পরে আলী হোসেন ছেলেকে "" আইও বাজান "" বলে ডাক দেয় ।",2,63,66
ডাক,আর তারা তাদের ডাক সম্বন্ধে অবহিতও নয় ।,2,14,17
ডাক,এই শিয়ালের ডাকের জন্যই তার নাম হয়ে গেছে শিয়াল ।,2,12,15
ডাক,"ছেলেটা মাথা নিচু করে চলে যাচ্ছে , , এমন সময় পিছন থেকে মেয়ে টা ডাক দিলো , , , ,",2,64,67
ডাক,ভাই ডাক শুনে মাথা তুলে উপরে তাকালাম ।,2,4,7
ডাক,নিচুস্বরে একটা ডাক দিতেই তারা বেরিয়ে এল ।,2,15,18
ডাক,তখন নানিবুড়ীর ডাক পড়বে ।,2,15,18
ডাক,শেষ বেলারই ডাক - স্তব্ধ হলো উথাল-পাথাল খরস্রোতার বাঁক ।,2,11,14
ডাক,"এমন সময় মিতুর ডাকে প্রায় আঁতকে উঠে সে , "" আশিক ?",2,15,18
ডাক,"ধৈর্য্যের মাত্রা ছাড়িয়ে নীলাকে ডাক দিলাম "" ওগো শুনছো "" ।",2,33,36
ডাক,"একটা ডাক দিও আমায় ... কতদিন তোমার গলা শুনি না .. কতদিন বলো নাই , পাখি ভালো আছো তো ! !",2,5,8
ডাক,"হায় ভগবান , কী কস তুই মুখপুড়ি , সবাই বর্ষা চায় , তুমি কোকিলের ডাক শুনবে বলে , এই দাবদাহ রেখে দিতে চাও !",2,65,68
ডাক,"মানুষের ডাক না হয় না-ই শুনলাম , প্রকৃতির ডাক ( শাব্দিক অর্থে , প্রচলিত অর্থে না কিন্তু ) শোনারও চেষ্টা করি না ।",2,8,11
ডাক,"বৃষ্টির গতি বাড়ছে , মাঝে মাঝে মেঘের ডাক যেন কানের মধ্যে ঢুকে পড়ছে ।",2,37,40
ডাক,"তিনি বললেন : তাহলে তুমি সে ডাকে সাড়া দাও । """,2,27,30
ডাক,কোকিলরে তুই ডাকিস না আর কুহু কুহু স্বরে তোর সেই ডাকে বারেবারে তাকে বড় মনে পড়ে !,2,12,15
ডাক,"সানু চিৎকার করে স্বামীকে ডাকে - ' কইগো তিন্নির আব্বু , তোমার এখনও গোসল শেষ হইলো না ।",2,25,28
ডাক,সন্ধের ডাক এলে কাটতে থাকে মেঘ-কুয়াশার চাদর ।,2,7,10
ডাক,"আকাশে বিদ্যুৎ চমকালে , বৃষ্টি হলে , বা মেঘের ডাক শোনা গেলেই নদীর পশ্চিম পাড়ের আজিমগঞ্জ বিদ্যুৎহীন হয়ে পড়ে ।",2,45,48
ডাক,বাহিরের দিকে তাকিয়ে আছি হঠাৎ এই যে এই যে ডাক শুনে ভেতরে তাকিয়ে দেখি এক মেয়ে দাড়িয়ে আছে ।,2,42,45
ডাক,হঠাৎ আকাশের গলায় অনিন্দিতা ডাক শুনে তার ভাবনার ছেদ ঘটল ।,2,28,31
ডাক,সকালে ঘুমুতে দেখলে মা হয়ত ভালবেসে ডাক দিতনা – থাকনা ছেলেটা ঘুমোচ্ছে ঘুমাক ।,2,35,38
ডাক,এ বার এলে কয়েকটা পাখির ডাক তোমায় শিখিয়ে দেব ।,2,24,27
ডাক,"ছোট ভাই হঠাৎ ডাক দিয়ে বলল , তাড়াতাড়ি বারান্দায় আসো , দেখে যাও ।",2,13,16
ডাক,"মাথার ওপর দিয়ে হঠাৎ করে একটা পাখি শব্দ করে ডেকে ডেকে উড়ে গেল , সেই ডাক শুনে কেমন জানি মন খারাপ হয়ে যায় ।",2,69,72
ডাক,নেতাদের ডাকে নিমেষে শ'য়ে শ'য়ে মানুষ ভিড় জমাচ্ছেন ।,2,8,11
ডাক,প্রকৃতি ডাক দিলেও সাড়া না দিয়ে চোখ-মুখ বুজে থাকতে হতো ।,2,8,11
ডাক,উদ্দেশ্যহীন ঘুরে বেড়াচ্ছি তেমন সময় পেছন থেকে নজরুল ভায়ের ডাক ।,2,60,63
ডাক,"জিয়ার ভাবনায় ছেদ পড়ল কন্সটেবলের ডাকে , স্যার , ওই লোকটা এসেছে । '",2,35,38
ডাক,সেখানে এই টেলিভিশন – আমাদের এক পাড় উঠোনে ডাক দিয়ে যায় ।,2,42,45
