lemma,sentence,sense,start,end
ডাক,বাড়ছে গ্রাহক সন্তুষ্টি আর এভাবে দ্রুত ডিজিটালাইজেশনের পথে এগিয়ে যাচ্ছে বাংলাদেশ ডাক বিভাগ ।,0,82,85
ডাক,নরওয়েজীয় ডাক ও টেলিযোগাযোগ কর্তৃপক্ষ ।,0,11,14
ডাক,বহিঃবিশ্বের ডাক বিভাগ,0,12,15
ডাক,ডাক বিভাগের বিদ্যমান জনবল দিয়েই তা সম্ভব ।,0,0,3
ডাক,আগ্রহী প্রার্থীকে মার্চের মধ্যে ডাকে আবেদনপত্র পাঠাতে হবে ।,0,32,35
ডাক,আপ্লাই করার সপ্তাহ খানেকের মধ্যে ইন্টারভিউ-এর ডাক এলো ই-মেইলের মাধ্যমে - এটাও উল্লেখ করা হলো যে এ বাবদ কোন প্রকার টি .,0,46,49
ডাক,"এর সঙ্গে পরিবহণ , জ্বালানি , বিমা , টেলিকম , প্রতিরক্ষা , ডাকের মতো ক্ষেত্রগুলির একটা বড় অংশই অচল থাকবে বলে আশঙ্কা ।",0,58,61
ডাক,"যথাযোগ্য মর্যাদায় দিবসটি পালন এবং প্রতিপাদ্যকে অর্থবহ করতে ডাক , টেলিযোগাযোগ ও তথ্যপ্রযুক্তি মন্ত্রণালয় এবং বিটিআরসি বিশেষ অনুষ্ঠানের আয়োজন করেছে ।",0,60,63
ডাক,ডাক অধিদপ্তর ও সোনালী ব্যাংকের মধ্যে স্বাক্ষরিত চুক্তি অনুযায়ী ডাক বিভাগ প্রত্যন্ত অঞ্চলে সুবিধা বঞ্চিত মানুষের মধ্যে ডিজিটাল ব্যাংকিং ব্যবস্থা প্রবর্তনের ব্যবস্থা করবে ।,0,0,3
ডাক,"তিনি বলেন , "" লাখ টাকার চেক ডিজঅনার হওয়ার পর গত সেপ্টেম্বর আমি সালুটিকর ও সাহেববাজার পোস্ট অফিস থেকে রেজিস্ট্রি ডাকে এক মাসের মধ্যে টাকা দিতে ফখরুলের কাছে উকিল নোটিশ পাঠাই ।",0,113,116
ডাক,ব্যাংকিং সেবার বাইরে থাকা কোটিরও বেশি মানুষকে আগামী এক বছরে ' ডাক টাকা ' সেবার আওতায় আনার লক্ষ্য নির্ধারণ করেছে ডাক বিভাগ ।,0,62,65
ডাক,"অলস পড়ে থাকা এই টাকায় ওয়াইফাই হটস্পট , দুর্গম এলাকায় ইন্টারনেট এবং প্রাকৃতিক দুর্যোগে টেলিযোগাযোগ সেবায় ব্যয়ের পরিকল্পনার কথা জানিয়েছিল ডাক ও টেলিযোগাযাগ বিভাগ ।",0,143,146
ডাক,"শরীয়তপুর প্রধান ডাকঘর পোষ্ট মাষ্টার শাহ মোহাম্মদ সোহেল বলেন , কার্যক্রম চালানোর বিকল্প জায়গা না থাকায় এ ঝুকিপূর্ণ ভবনেই দাপ্তরিক কার্যক্রম চালাতে হচ্ছে ডাক বিভাগকে ।",0,155,158
ডাক,দেড় দশকে ডাক বিভাগে চিঠি বিলির সংখ্যা কমেছে কোটি ।,0,10,13
ডাক,পাকিস্তানি মূদ্রার ওই টি ডাক টিকিটের সিরিজের দাম পড়ছে টাকা ।,0,25,28
ডাক,ডাক বিভাগ আশা করছে অন্যান্য মোবাইল ফিন্যান্সিয়াল সার্ভিসের মতো ' ডাক টাকা ' দেশের মানুষকে ব্যাংকিং সুবিধার আওতায় আনতে সহযোগিতা করবে ।,0,0,3
ডাক,ব্রিটেইনের রাজা অষ্টম হেনরি সালে রয়্যাল মেইলের আদি ডাক প্রতিষ্ঠানটি স্থাপন করেন ।,0,52,55
ডাক,এছাড়াও জাতির পিতা বঙ্গবন্ধু শেখ মুজিবুর রহমানের জন্মশতবার্ষিকী উপলক্ষে ডাক ও টেলিযোগাযোগ বিভাগের উদ্যোগে স্মারক ডাকটিকিট প্রকাশ করা হয়েছে ।,0,72,75
ডাক,এই আইনে ইস্ট ইন্ডিয়া কোম্পানির আওতাধীন সমস্ত জায়গায় ডাকবহনের কর্তৃত্ব এককভাবে সরকারের ওপর ন্যস্ত হয় এবং বেসরকারি প্রতিষ্ঠানের ডাক নিষিদ্ধ করে দেয়া হয় ।,0,130,133
ডাক,বাংলাদেশর ডাকব্যবস্থা বিশ্বে সর্বপ্রথম ডাক ব্যবস্থার প্রচলন হয় – মিশরে খ্রিষ্ট্রপূর্বাব্দে ভারতীয় উপমহাদেশে ঘোড়ার ডাকের প্রচলন করেন – শোরশাহ বিশ্বের প্রথম ডাক টিকিট চালু হয় – ইংল্যান্ড বিশ্বের প্রথম ডাক টিকিটের নাম – পেনিব্লাক ডাকটিকিটে দেশের নাম লেখা থাকে না – ইংল্যান্ড ভারতীয় উপমহাদেশে প্রথম ডাকটিকিট চালু হয় – সালে বাংলাদেশে প্রথম ডাকটিকিট চালু হয় – সালে বাংলাদেশের প্রথম ডাকটিকিটে ছিল – বাংলাদেশের মানচিত্রের ছবি বাংলাদেশের ডাক টিকিটের ডিজাইনার – বিমান মল্লিক স্বাধীনতার পর প্রথম ডাকটিকিট প্রকাশিত হয় – স্বাধীনতার পর প্রকাশিত প্রথম ডাকটিকিটে ছিল – শহিদ মিনারের ছবি স্বাধীনতার পর প্রথম প্রকাশিত ডাক টিকিটের ডিজাইনার – জিপিও বাংলাদেশের পোস্ট অফিস জাদুঘর অবস্থিত – ঢাকার জিপিও বাংলাদেশের একমাত্র পোস্টাল একাডেমি – রাজশাহীতে বাংলাদেশের প্রথম ডাকঘর স্থাপিত হয় – চুয়াডাঙ্গায় বাংলাদেশের সঙ্গে ডাক যোগাযোগ নেই – ইসরাইলের,0,39,42
ডাক,বুধবার পাকিস্তানের জাতীয় সুরক্ষা কমিটির ( এনএসসি ) বৈঠককালে গৃহীত সিদ্ধান্তের সঙ্গে সামঞ্জস্য রেখে এই পদক্ষেপ নেওয়া হয়েছে বলে জানিয়েছেন পাকিস্তানের যোগাযোগ ও ডাক পরিষেবা মন্ত্রী মুরাদ সঈদ ।,0,162,165
ডাক,চলমান লকডাউনে প্রান্তিক কৃষকদের উৎপাদিত পণ্য রাজধানী ঢাকার পাইকারি বাজারে বিনা মাশুলে পৌঁছে দিতে ' কৃষক বন্ধু ডাক সেবা ' নামে একটি সেবা চালু করেছে ডাক অধিদপ্তর ।,0,110,113
ডাক,বাংলাদেশ সরকার ঘোষিত '' মুজিব বর্ষ-২০২০ '' যথাযোগ্য মর্যাদায় উদযাপনের লক্ষে ডাক অধিদপ্তর প্রান্তে গৃহীত কর্মসূচীর অংশ হিসেবে '' মাননীয় প্রধানমন্ত্রী শেখ হাসিনার শুভেচ্ছা বার্তা ও স্বাক্ষর সম্বলিত পোস্টকার্ড '' চার কোটি দশ লক্ষ পরিবার এর নিকট বিনামূল্যে বিতরণ করা হচ্ছে ।,0,77,80
ডাক,"ডাক যোগাযোগ বাংলাদেশের প্রথম ডাকটিকিট প্রকাশিত হয় - জুলাই , প্রথম ডাকটিকিটে ছবি ছিল - বাংলাদেশের মানচিত্রের স্বাধীনতার পর স্বাধীন বাংলাদেশে প্রথম ডাকটিকিট প্রকাশিত হয় - ফেব্রুয়ারি স্বাধীনতার পর প্রথম ডাকটিকিটের ডিজাইনার ছিলেন - বিমান মল্লিক স্বাধীনতার পর প্রথম ডাকটিকিটে ছবি ছিল - বাংলাদেশের মানচিত্র সালের মার্চ প্রকাশিত ডাকটিকিটে ছিল - আগুনের ফুলকি বাংলাদেশে পোস্ট কোড চালু হয় - সালে স্বাধীন বাংলাদেশের প্রথম ডাকঘর - চুয়াডাঙায় ডাক বিভাগের মনোগ্রাম - একজন ধাবমান রানারের কাঁধে চিঠির ব্যাগ ঝোলানো , হাতে একটা বল্লম , মাথায় প্রজ্বলিত লণ্ঠন ডাক বিভাগের শ্লোগান - সেবাই আদর্শ ডাক বিভাগের সদর দপ্তর - ঢাকায় ডাক যাদুঘর - ঢাকার জিপিওতে একমাত্র পোস্টাল একাডেমি - রাজশাহীতে GEP চালু হয় - EPP চালু হয় - ডাক যোগাযোগ নেই - ইসরায়েলের সঙ্গে টেলিযোগাযোগ টিএন্ডটি সদর দপ্তর - ঢাকায় T & T - Bangladesh Telegraph & Telephone Board BTRC - Bangladesh Telecom Reguletory Board পার্বত্য চট্টগ্রামে মোবাইল ফোন সার্ভিস শুরু হয় - মে",0,0,3
ডাক,"পোস্টমাস্টার আবুল কালাম আজাদ বলেন , ' ডাক বিভাগের অবকাঠামো ব্যবহার অনুপযোগী হওয়ায় সেখানে বসে সেবা দেওয়া সম্ভব নয় ।",0,38,41
ডাক,বিশ্ববিদ্যালয়ের পঞ্চাশ স্মরণে ভারতীয় ডাক ও তার বিভাগের সহযোগিতায় প্রকাশ পাবে একটি বিশেষ প্রথম দিবস কভার ।,0,39,42
ডাক,তবে সুসামির এই ডাক বাক্সটিই বিশ্বের একমাত্র ' আন্ডার ওয়াটার পোস্টবক্স ' নয় ।,0,15,18
ডাক,সালের এই দিনে কলকাতা-লন্ডন ডাক যোগাযোগ ব্যবস্থা চালু হয় ।,0,27,30
ডাক,মন্ত্রীর নির্দেশে ডাক অধিদপ্তর সেবাটি চালু করে ।,0,18,21
ডাক,নিউজ ডেস্ক : ডিজিটাল আর্থিক সেবাদাতা প্রতিষ্ঠান ' নগদ ' - এর শতাংশ মালিকানা নিচ্ছে ডাক বিভাগ ।,0,83,86
ডাক,ভারতের ওষুধ প্রস্তুতকারী অ্যাসোসিয়েশনের সঙ্গে ডাক বিভাগ যৌথভাবে গুজরাটে জরুরি চিকিৎসা সরঞ্জাম ও ওষুধ পৌঁছে দেওয়ার কাজ শুরু করেছে ।,0,47,50
ডাক,"অতঃপর মার্কিন ডাক বিভাগের অনুসন্ধান বিভাগ , ইন্ডিয়ানা রাজ্য পুলিশ এবং অভ্যন্তরীণ রাজস্ব বিভাগের যৌথ তদন্তে এই দম্পতির জালিয়াতি ধরা পড়ে ।",0,14,17
ডাক,"পদাধীকার বলে ডাক ও টেলিযোগাযোগ সচিব ফ্রিকোয়েন্সি এলোকেশন কমিটির চেয়ারম্যান , আর চালাচ্ছে সর্বনিম্ন ব্যবহার নীতিতে ।",0,13,16
ডাক,বাংলাদেশ ডাক বিভাগের সদর দপ্তর – ঢাকায় বাংলাদেশ ডাক বিভাগ কর্তৃক প্রকাশিত ত্রৈমাসিক পত্রিকা - ডাকপ্রবাহ,0,9,12
ডাক,ক্যাবিনেটে ডাক পাওয়ার সে খবর সচিবালয় বিট করেন এমন এক সাংবাদিক সহকর্মীর মাধ্যমে অগ্রিম জেনে অভিনন্দন জানানোর জন্য উনাকে ফোন করলাম উনার ... এই নাম্বারে ।,0,11,14
ডাক,রাষ্ট্রীয় ডাক ও প্রাতিষ্ঠানিক ডাক ছাড়া চিঠি আদান-প্রদান শূন্যের কোঠায় ।,0,11,14
ডাক,"ডাক ও টেলিযোগাযোগ প্রতিমন্ত্রী তারানা হালিম বলেছেন , মাসিক থেকে৩০ টাকা কিস্তিতে শ্রমজীবীসহ সকল স্তরের মানুষের কাছে স্মার্টফোন পৌঁছে দেওয়া . .",0,0,3
ডাক,যুক্তরাষ্ট্রের ইতিহাসে বিরল ঘটনা হিসেবে ড্যাকোটা থেকে ওহাইয়ো পর্যন্ত ডাক ব্যবস্থা বন্ধ রাখা হয়েছে ।,0,70,73
ডাক,কিন্তু শাস্তির দাবি তুলে সৃষ্টিশীলতাকে চ্যালেঞ্জ করার জন্যে বঙ্গবন্ধু এদেশ স্বাধীন করার ডাক দিয়েছিলেন বলে আমি মনে করি না ।,1,88,91
ডাক,"বঙ্গবন্ধুর ডাকে সাড়া দিয়ে তারা যুদ্ধ করেছিলেন , তাই তাদেরকে লাখো সালাম জানাই ।",1,11,14
ডাক,শাহবাগ আন্দোলনের সেই ডাকে আজ মিলিত হয়েছে সারাদেশের একাত্তর পরবর্তী প্রজন্মের তরুণ প্রাণ ।,1,21,24
ডাক,"তিনি বলেন , দেশের জনগন প্রধানমন্ত্রী শেখ হাসিনার সরকারের উন্নয়নে এত খুশি যে সাড়ে আটবছর বারে বারে আন্দোলনের ডাক দিলেও জনগন তাতে সাড়া দেয় নি ।",1,109,112
ডাক,আর একুশে ফেব্রুয়ারি উদযাপন কমিটির অনুষ্ঠানের খবর আছে কমিটির নিজের প্রকাশিত ' একুশের ডাক ' স্মরণিকায় ।,1,85,88
ডাক,জাতির উদ্দেশ্যে দেয়া ভাষণে ডাক দিলেন সর্বস্তরের জনতাকে কৃষকের পাশে দাঁড়াতে ।,1,28,31
ডাক,বৈঠক শেষে বঙ্গবন্ধু ও মার্চ তৎকালীন পাকিস্তানে সর্বাত্মক হরতালের ডাক এবং মার্চ তৎকালীন রেসকোর্স ময়দানে ( বর্তমানে সোহরাওয়ার্দী উদ্যান ) জনসভার ঘোষণা দেন ।,1,65,68
ডাক,সে সময় ইংরেজ বিরোধী আন্দোলনের ডাক দিয়ে জনমনে জায়গা করে নেন ভারতবর্ষের কিংবদন্তি নেতা মহাত্মা গান্ধী ।,1,31,34
ডাক,"স্বাধীনতার স্বপ্ন বাস্তবায়নের নিমিত্তে সালে তৎকালীন ছাত্রলীগ নেতা আবদুল আজিজ বাগমারের নেতৃত্বে গড়ে উঠে ' অস্থায়ী পূর্ববঙ্গ ( অপূর্ব ) সরকার ' নামে একটি গোপন সংগঠন । রাজনৈতিক নেতৃত্ব যথাসময়ে যাতে স্বাধীনতার ডাক দিতে সক্ষম হন সে কাজকে সহজতর করার উদ্দেশ্যে স্বাধীনতার বানী ঘরে ঘরে পৌছেঁ দেওয়ার শপথ নিয়ে সংগঠনটি গঠিত হয় । সংগঠক হিসেবে ছিলেন ঢাবি ছাত্র খন্দকার বজলুল হক , শান্তি নারায়ণ ঘোষ ( উভয়ে বর্তমানে ঢাবির শিক্ষক ) প্রাণেশ কুমার মণ্ডল , হাবিবুর রহমান ও অন্যান্য ।",1,210,213
ডাক,যদি আব্দুল জলিলের মতো সরকারকে এপ্রিলের মতো সরকার পতনের ডাক দিতো তা হলে আওয়ামী লীগ কি করতো তা আল্লাহই জানে ।,1,55,58
ডাক,তিনি খ্রিস্টান ক্রুসেডারদের বিরুদ্ধে জিহাদের ডাক দিয়ে বিখ্যাত হয়েছিলেন ।,1,45,48
ডাক,• কোচবিহারের মহারাজা নৃপেন্দ্র নারায়ণের জন্মসার্ধশতবর্ষে স্মারক ডাক টিকিট প্রকাশের আবেদন পেতেই মহারাজের সম্পর্কে তথ্য সংগ্রহে উদ্যোগী হল ডাক বিভাগ ।,1,65,68
ডাক,"দৈনিকসিলেটডটকম : মজলুম জননেতা মওলানা আব্দুল হামিদ খান ভাসানীর নেতৃত্বে অনুষ্ঠিত ঐতিহাসিক ফারাক্কা লংমার্চ দিবস উপলক্ষে মওলানা ভাসানী ফাউন্ডেশন সিলেটের উদ্যেগে মঙ্গলবার সন্ধ্যায় নগরীর শাহজালাল উপশহরস্থ কার্যালয়ে আয়োজিত আলোচনা সভায় বক্তারা ঐতিহাসিক ফারাক্কা লংমার্চের তাৎপর্য ব্যাখা করে বলেন , প্রতিবেশী রাষ্টের আগ্রাসী কর্মকান্ডের মাধ্যমে বাংলাদেশকে মরুভূমিতে পরিণত করা এবং পরিবেশের ভারসাম্য বিনষ্ট করার গভীর ষড়যন্ত্রের বিরুদ্ধে মজলুম জননেতা মওলানা ভাসানী ফারাক্কা লংমার্চের ডাক দিয়েছিলেন ।",1,479,482
ডাক,এরপর মার্চ যখন তিনি স্বাধীনতা সংগ্রামের ডাক দেন । পাকিস্তানের সশস্ত্র আক্রমনের মুখে দিশেহারা জাতির কাছে সেটাই ছিল আশার আলো ।,1,40,43
ডাক,"আমরা কোটি কোটি জনগণ যেমন বঙ্গবন্ধুর ডাকে সাড়া দিয়ে যুদ্ধে ঝাঁপিয়ে পড়েছিলাম , প্রাণ দিয়েছিলাম , তিনিও স্বাধীন দেশ প্রতিষ্ঠা করে তার প্রতিদান দিয়েছেন ।",1,36,39
ডাক,"ডাক দেন এই বলে যে , "" ভূমিবিষয়ক কর্মসূচীতে গুরুত্বের ভরকেন্দ্রটা ক্ষেতমজুর প্রতিনিধি সোভিয়েতের হাতে তুলে দিতে হবে ।",1,0,3
ডাক,"যারা আমাদের ডাকে সাড়া দিয়ে সার্বিক সহযোগিতা করেছেন , তাদেরকে ধন্যবাদ ও কৃতজ্ঞতা জানাচ্ছি । '",1,12,15
ডাক,লেখকদের ঐক্যের ডাক দিলেন হাসান আজিজুল হক,1,15,18
ডাক,তিনি দফার ভিত্তিতে রাজবন্দিদের মুক্ত করার জন্য ' জেল ভাঙা ' নামে এক আন্দোলনের ডাক দেন ।,1,78,81
ডাক,বঙ্গবন্ধুর ডাকে অহিংস অসহযোগ আন্দোলন চলছিল বাংলার সর্বত্র ।,1,11,14
ডাক,এর প্রতিবাদে ওই দিন বিকেলে হোটেল পূর্বাণীতে অনুষ্ঠিত এক সভায় বঙ্গবন্ধু অসহযোগ আন্দোলনের ডাক দেন ।,1,89,92
ডাক,"শাহবাগের ডাকে সাড়া দিয়েছিল স্কুল শিশুরাও আরেকটা বড় চাপ হচ্ছে , দায়বদ্ধতার জায়গা ।",1,9,12
ডাক,"সংসদীয় কমিটির ডাকে সাড়া দিলেন না ওয়াসার এমডি , ক্ষোভ প্রকাশ",1,15,18
ডাক,"আমরা জাতীয় ঐক্যের ডাক দিয়েছি বাস্তবতার প্রেক্ষিতে , সেই বাস্তবতায় আমরা অন্যান্য রাজনৈতিক দলগুলোর সঙ্গে কথা বলতে শুরু করেছি ।",1,19,22
ডাক,অত্যন্ত সম্পন্ন পরিবারের ছেলে মহসিন নেতার ডাকে মুক্তিযুদ্ধে গেছেন ; জীবনবাজী রেখেছেন ।,1,42,45
ডাক,সেজন্য আমরা জাতীয় ঐক্যের ডাক দিয়েছিলাম ।,1,26,29
