lemma,sentence,sense,start,end
পটল,"ডাল-ভাতের সঙ্গে থাকে আলু , পটল , বেগুন , কুমড়ো ও বড়া মিলিয়ে পাঁচ রকমের ভাজা , আলু-কপি , অথবা আলু-পটলের দোর্মা , পাঁচ তরকারি , রুই মাছের ঝোল , শাক , চাটনি , মিষ্টি ও পায়েস ।",0,27,30
পটল,কড়াইতে দু'চামচ ঘি দিয়ে পটল ভেজে তুলুন ।,0,25,28
পটল,রুই মাছ কেউ পটল দিয়ে রান্না করে ?,0,12,15
পটল,"তবে চরাঞ্চলগুলোতে ভুট্টা , মরিচ , মিষ্টি কুমড়া , পাটসহ বিভিন্ন ফসলের উৎপাদন বৃদ্ধি পাওয়ায় কৃষকরা অপেক্ষাকৃত কম জমিতে এ বছর পটল চাষ করেছে বলে জানা গেছে ।",0,126,129
পটল,"তবে বেগুন , পটল , ঢেঁড়স , ঝিঙা , করলার পর্যাপ্ত সরবরাহ থাকলেও দাম কমেনি ।",0,12,15
পটল,"মহকুমা কৃষি আধিকারিক অশ্বিনী কুম্ভকার বলেন , "" কুমড়ো , লাউ , পটল , ঝিঙে , বেগুন , লঙ্কাএ সব ফসলে জমিতে এক দিনের বেশি জল জমে থাকলেই পচন ধরে যায় ।",0,62,65
পটল,"বেগুন , ঢেড়স , ঝিঙ্গা , কাকরল , পটল বিক্রি হচ্ছে টাকায় ।",0,33,36
পটল,"কাঁচা মরিচ , করলা , গাজর , টমেটো , পটল , বরবটি - , বেগুন , কাকরোল , লতি , মূলা , উস্তা , পেঁপে , ঢেড়শ , মরিচ টাকা করে কেজি প্রতি বিক্রি হচ্ছে ।",0,35,38
পটল,"এবার কষানো মশলায় গাজর , পটল , টক আচার ও লবণ দিয়ে মিনিট ঢাকনা দিয়ে রেখে দিন ।",0,25,28
পটল,"ইউরোপীয় ইউনিয়ন সালের এপ্রিল থেকে উচ্ছে , বেগুন , পটল , করলা , কাঁকরোল এবং চিচিঙ্গা – এই ছ'রকম আনাজ আমদানি বন্ধ করে দিয়েছিল ।",0,51,54
পটল,বিভিন্ন সবজির মধ্যে পটল টাই বেশি করে ফলে আলাউদ্দিন ।,0,20,23
পটল,পটল সবজি হিসেবেই আমরা খেয়ে থাকি কিন্তু এই পটল ও এর বিচিতে রয়েছে অগণিত স্বাস্থ্য উপকারিতা ।,0,0,3
পটল,"গ্রামের বাড়ি বাড়ি গিয়ে চাল ডাল , আলু পটল , হাঁড়ি পাতিল এসব চেয়ে আনা হয়েছে ।",0,40,43
পটল,"এরপর গ্রামের কৃষক কিবরিয়া , নিজাম , শুকুর আলী , গোলাম মোস্তফা ও বসির উদ্দিনসহ অনেক কৃষকের জমির ফসল পটল , কলা , পেঁপেঁ মুগ , পাট , আম , লিচু ও পানবরজসহ মাঠে থাকা ফসল ক্ষতি করতে থাকে ।",0,100,103
পটল,"হাওড়া ব্রিজের শেষদিকের ফুটপাতে ভেন্ডি , পটল , কাঁচা মরিচ বিক্রি করেন রানী দে ।",0,41,44
পটল,"বাজারে একাধিক চাষি তাদের উৎপাদিত লাল শাক , লাউ , কলা , পটল , করল্লা , পুদিনা পাতা , মিষ্টি কুমড়া , পেঁপে , চিচিংগা , আম , কাঠালসহ বিভিন্ন প্রকার শাক-সবজি ও ফলমূল নিয়ে বাজারে হাজির হয় ।",0,55,58
পটল,"গতকাল নিত্যপণ্যের বাজার ঘুরে দেখা যায় , বরবটি - টাকা , পটল - টাকা , ঢেঁড়স - টাকা , কচুর লতি - টাকা , করলা মান ভেদে - টাকা , শিম - টাকা কেজি দরে বিক্রি হয় ।",0,56,59
পটল,"কী লাগে : গোটা পটল টি , নারকেল আধমালা , সাদা সর্ষে এক চামচ , টক দই চার চামচ , হলুদ গুঁড়ো-চিনি-নুন পরিমাণ মতো , সর্ষে তেল , গোটা কাঁচালঙ্কা টি ।",0,15,18
পটল,"ঝিঙা , চিচিঙ্গা , ধুন্দল , পটল , কচুর লতির কেজি থেকে টাকা ।",0,27,30
পটল,"টমেটোর মতো দাম বাড়ার তালিকায় রয়েছে চিচিঙ্গা , পটল , ঝিঙা , ধুন্দল , কাকরোল , করলা , বরবটি ।",0,49,52
পটল,"সপ্তাহের ব্যবধানে কেজিতে দু থেকে তিন টাকা বেড়েছে পটল , কাঁকরোল , ঝিঙ্গা , চিচিঙ্গার দাম ।",0,50,53
পটল,পটল ধুয়ে ছিলে টুকরা করে কেটে নিন ।,0,0,3
পটল,"তিনি আরও জানান , এদিন টাকার করলা টাকা , - টাকার পটল টাকা , টাকার ঢেঁড়স - টাকা , পেঁপে তিন টাকা বেড়ে টাকা , ঝিঙ্গা - টাকা বেড়ে - টাকা , বরবটি - টাকা বেড়ে টাকায় বিক্রি হচ্ছে ।",0,48,51
পটল,"পুষ্টিবিদদের মতে , শাক-সবজি , আলু , পটল , কুমড়ো-গাজর বেশি করে খান ।",0,36,39
পটল,"পাশাপাশি চিচিঙ্গা - টাকা , কচুর লতি - টাকা , পটল ও ঢেঁড়স - টাকা , কাকরোল - টাকা , কচুর মুখি - টাকা কেজি দরে বিক্রি হচ্ছে ।",0,45,48
পটল,তারা বলেন হাইব্রিড শশা বিক্রি হচ্ছে টাকা দেশি শশা টাকা চিচিংগা টাকা কাকরোল টাকা ঢেড়শ টাকা পটল টাকা বেগুন টাকা ও টমেটো টাকা দরে বিক্রয় করা হচ্ছে ।,0,91,94
পটল,"আলু , লাউডগা , দুচারটে পটল , পাঁচফোড়নে স্যাঁৎলানোর সময় যে গন্ধটা ছাড়ে , সেটা মনে পড়ে জিভে জল এল ।",0,23,26
পটল,তাই আমি আর কোনদিন খাবো না চিংড়ী দিয়ে পটল ।,0,39,42
পটল,"এর ফাঁকে ফাঁকে সাথী ফসল হিসেবে কেউ লাগিয়েছেন বেগুন , কেউবা পটল ও পেঁপে গাছ ।",0,60,63
পটল,"এ জেলায় ফুলকপি , বাঁধাকপি , মুলা , লাউ , কুমড়া , শসা , শিম , পটল , ঝিঙে , বেগুনসহ বিভিন্ন জাতের সবজি উৎপাদন হয় প্রচুর পরিমাণে ।",0,63,66
পটল,পটল গাছে ফেব্রুয়ারি থেকে ফল ধরা শুরু হয়ে অক্টোবর পর্যন্ত মোট নয় মাস সংগ্রহ করা যায় ।,0,0,3
পটল,এছাড়া মাটির উপর খড়-কুটা বা কচুরীপানা দিয়ে তার উপর পটল গাছ তুলে দিলে তা থেকেও ভাল ফলন পাওয়া যায় ।,0,53,56
পটল,"তাঁরা জানান , ঝিঙে , পটল , বরবটির মতো সব্জির পাতা হলুদ হয়ে শুকিয়ে যাচ্ছে ।",0,21,24
পটল,"পটল চাষীরা জানান , কার্তিক মাসে জমিতে থেকে টি চাষ দিয়ে থেকে ইঞ্চি মাটির নীচে পটলের লতা ( গাছ ) রোপন করা হয় ।",0,0,3
পটল,মুড়িফসল হিসাবে পটল : পটোল মুড়ি ফসল হিসেবে চাষ করা যায় ।,0,16,19
পটল,"তার পরে আচমকা বৃষ্টিতে লঙ্কা , মুলো , শাক , পটল , বেগুনের মতো প্রয়োজনীয় সব্জি পচে গিয়েছে ।",0,44,47
পটল,"মানিকতলা ও ল্যান্সডাউন বাজারে এ দিন ঢেঁড়স , পটল ও ঝিঙে টাকা কিলোগ্রাম দরে বিক্রি হয়েছে ।",0,45,48
পটল,প্যানে সরিষার বা আচারের তেল দিয়ে ভেঙে রাখা পটল ভেজে পানি শুকিয়ে নিন ।,0,44,47
পটল,"আলু-পটলের তরকারির মতো রোজকার সাধারণ পদ যেমন বানানো যায় , তেমনই দই পটল বা পটলের দোলমার মতো বাহারি মুখরোচক পদও অনায়াসে বানিয়ে ফেলা যায় ।",0,4,7
পটল,"এছাড়াও করলা , পটল , কলা , বেগুন , পেঁপেসহ বিভিন্ন সবজির ক্ষেতের ব্যাপক ক্ষয়ক্ষতি হয়েছে ।",0,15,18
পটল,উষ্ণ জলবায়ু পটল চাষের জন্য উপযুক্ত ।,0,13,16
পটল,"পাতে ভাত , ডাল , পালং শাক , বেগুন ভাজা , পটল ভাজা , আলুপোস্ত ।",0,41,44
পটল,"বা , বাস্তবের হাটের যে অতুলনীয় রূপকল্প যেমন , উচ্ছে বেগুন পটল মুলো / বেতের বোনা ধামা কুলো / সর্ষে ছোলা ময়দা আটা / শীতের রাপার নক্শা কাটা .. ,",0,59,62
পটল,"এ ছাড়া , বেগুন , পটল , আলু ইত্যাদি-প্রভৃতির ভাজা তো আছেই ।",0,18,21
পটল,"ধান ছাড়াও এ জেলায় গম , ভুট্টা , সরিষা , তিল , চিনাবাদাম , ছোলা , মটর , খেসারি , মাসকলাই , মুগ , মরিচ , পেঁয়াজ , রসুন , আদা , হলুদ , ধনিয়া , আলু , পটল , বেগুনসহ বিভিন্ন প্রকার সবজি ছাড়াও আখ , পাট তামাক চাষ হয়ে থাকে ।",0,150,153
পটল,"প্রশাসন ও স্থানীয় সূত্রে জানা গিয়েছে , এ দিন সিউড়ির বাজারে লঙ্কা - টাকা , পটল - টাকা , ঝিঙে - টাকা , বেগুন - টাকা প্রতি কেজি দরে মিলেছে ।",0,77,80
পটল,"এর মধ্যে থাকে আলু পটল ফুলকপি , নানারকম তরকারি ।",0,18,21
পটল,"আয়ুর্বেদী চিকিৎসায় ঠাণ্ডা , জ্বর ও গলা ব্যথা কমতে ওষুধ হিসেবে ব্যবহার করা হয় পটল ।",0,80,83
পটল,"এছাড়া শশা , কাকরোল , পটল , বেগুনসহ অন্য সবজির দাম রুপি থেকে রুপি প্রতি কেজি দরে বিক্রি হচ্ছে ।",0,22,25
পটল,"সঙ্গে বেড়েছে বেগুন , শসা , করলা পটল , পেঁপের দাম ।",0,33,36
