lemma,sentence,sense,start,end
পটল,"কিছু কিছু প্রশ্নের উত্তর দেয়া সম্ভব হয়নি – মানুষ মারা গেলে কেন সেটাকে "" পটল তোলা "" বলা হয় সেরকম একটা প্রশ্ন !",1,74,77
পটল,"পিতার মৃত্যুর জন্য অপেক্ষা করে করে তিনি নিজেও পটল তুললেন সালে , আওরঙ্গজেব মারা যাবার তিন বছর আগে ।",1,46,49
পটল,"তবে আফসোস , হোঁদল রাজা এবং বুদ্ধু রাজা শেষ পর্যন্ত পটল তুললেও আমাদের দুই রানীর যুদ্ধে প্রাণ শুধু উলু-খাগড়ারই যাচ্ছে ।",1,51,54
পটল,ততক্ষণে আরও দুটো ব্ল্যাকবেরী আইস্ক্রিম পটল তুলল ।,1,39,42
পটল,পটল তুলেও বেঁচে এল সৌরভ ।,1,0,3
পটল,তার পটল তোলা নিশ্চিত করবে ।,1,4,7
পটল,- না মানে কালকে রাতে আপনার অবস্থা খুব খারাপ হয়ে গিয়েছিলো তাই ভাবলাম আবিদ হেসে বলল - তাই ভাবলে বুড়োটা বুঝি এবার সত্যি সত্যিই পটল তুললো ।,1,127,130
পটল,"কিছু কিছু প্রশ্নের উত্তর দেয়া সম্ভব হয়নি - মানুষ মারা গেলে কেন সেটাকে ' পটল তোলা ' বলা হয় , সেরকম একটা প্রশ্ন ।",1,74,77
পটল,তাদের অনেকেই আবার ওখানেই পটল তুলেছে ।,1,25,28
পটল,"বিপজ্জনক একটা ঝুঁকি নিতে যাচ্ছে ও , এক চুল এদিক ওদিক হয়ে গেলে সবাইকে নিয়ে পটল তুলতে হবে ।",1,76,79
পটল,"কখন কে পটল তোলে , তার কোনো সঠিক নিয়ম কানুন বা ঠিক ঠিকানা নেই ।",1,7,10
পটল,"মানুষ লক্ষ হাজার বছর আগে আগুন ব্যাবহার শিখেছে কিন্তু কোন নিয়ন্ত্রণ ছিল না তাতে , মাত্র হাজার বছর আগে মানুষ নিয়ন্ত্রিত উপায়ে আগুনের ব্যাবহার শিখেছে । আগের মানুষের গড় আয়ু ছিল মাত্র বছর , চিন্তা করুন একটা মানুষের যদি যুবক হতে হতেই পটল তোলার সময় হয়ে যায় তাহলে সে গবেষণা বা জ্ঞান কিভাবে করবে আর কিভাবেই বা পরবর্তী প্রজন্মে তা বিতরণ করবে ।",1,233,236
পটল,"আজকের সরকার কিংবা বিরোধী পটল তুলবেন , কিন্তু এই পঠলের রেখে যাওয়া গোপন মাইনগুলো আগামীর অসংখ্য সম্ভাবনাকে রক্তাক্ত করবে ।",1,25,28
পটল,পৃথিবীতে বহু ভাষা পটল তুলেছে - দুটো কারনে ।,1,18,21
পটল,"হর্ষ বিষাদ শোক বিস্ময় সবই গেছে ভুলে , মনে হচ্ছে বসে আছে তারাই পটল তুলে ।",1,63,66
পটল,"এই আৎকা অভিযানে নায়ক চারদিনে দুইবার গুলিও খায় , পুরা ভিলেন বাহিনী সাফ হয়ে যায় , নায়িকা মুক্তি পায় আর বোনাস হিসেবে দুই নাম্বার নায়িকা পটল খায় মানে পটল তোলে আরকি !",1,140,143
পটল,"কেউ আসছে সোনার চামচ মুখে নিয়ে , লাট বাবার সম্পদ বসে বসে খায় আর একসময় চক্ষু উল্টিয়ে পটল তুলে ।",1,87,90
পটল,তুমি পটল প্রায় তুলে ফেলেছিলে ।,1,5,8
পটল,"কাজী আবু ইউসুফ ( রিফাত ) বলেছেন : সায়ানাইড গ্রহণ করলে কেউ ইংরেজিতে এর বানান লেখার আগেই পটল তুলে - আর আপনি বলেছেন : । ইভা ব্রাউন সায়ানাইড বিষ পান করেন , আর হিটলার নিজের মাথায় গুলি করেন এবং সম্ভবত সায়ানাইডও গ্রহণ করেছিলেন ।",1,88,91
পটল,ভাইটা বুঝি তুলবে পটল নিঃশ্বাসও বয়,1,17,20
পটল,"তারা ঠিক করেছেন সারাজীবন একই বাসায় থাকতে চান , এখানেই নাতি-নাতনির মুখ দেখতে চান , এখানেই পটল তুলতে চান ।",1,90,93
পটল,"আপনি যখন উপরে গিয়ে পটল তুলতে যাবেন , তখন কি আর আপনার মেয়ে দোয়া করবে কিনা সন্দেহ ।",1,20,23
পটল,মারের চোটে ভজা পটল তুলেছে-এ কী যে সে ব্যাপার ?,1,15,18
পটল,"তুমি না থাকিলে তো কবেই পটল তুলিতাম "" ।",1,23,26
পটল,মামু যে তোর কথা ভাবতেভাবতেই পটল তুলল রে ।,1,28,31
পটল,এরা ফেসবুক স্ট্যাটাসে দোয়া করে যাতে দেশের সব ডাক্তারের করোনা হয় এবং ওরা পটল তুলে ।,1,74,77
পটল,টেবিলে খাবার বেড়ে দিয়ে অসুস্থ স্ত্রী পটল তুলে টেবিলের পাশেই পড়ে আছেন ।,1,39,42
পটল,তার প্রতিটির সাথে মোকাবেলা করে এসে আমেরিকার সব স্তন্যপায়ীরা কেন নম্বর বরফ যুগের শেষের সময়টাকেই পটল তোলার উপযুক্ত সময় হিসেবে বেছে নেবে ?,1,97,100
পটল,. কবিতাকুমারী পটল তুলেছে গত ডিসেম্বরে পটের রানী সেজে জগৎ তোলপাড় করে করোনাকালে তোমার কাজ কী ?,1,14,17
পটল,যে নাকি সেলফি তুলতে গিয়েই পটল তুলেছিল ।,1,27,30
পটল,"হাবু এগিয়ে বলল , "" দেখুন , এর পর আর মারধোর করলে ও সত্যিই পটল তুলবে ।",1,58,61
পটল,তিনি তো আগেই পটল তুলেছেন ।,1,13,16
পটল,"যে বীরপুরুষেরা বাঘটিকে নিজের রাজ্যে ফিরে যাবার বিন্দুমাত্র সুযোগ না দিয়ে কোণঠাসা করে অন্য জগতে পাঠিয়ে দিল বাঁশের - বল্লমের ক্রমাগত আঘাতে , তারাই আবার ব্যপক উৎসাহে বর্ণনা করছিল আরেকটি বাঘও দেখা গেছে , তারা সেটির প্রতিক্ষায় আছে , মানে সেটিরও পটল তুলতেই হবে , এদের সাথে দেখা হলে !",1,243,246
পটল,আমি টনি কিংবা আর কাউকে পুরস্কার গ্রহণ করতে পাঠিয়ে প্রসন্নচিত্তে পটল তুলবো !,1,65,68
পটল,তার সমসাময়িক অনেক হিরোঞ্চি এবং গাঞ্জট্টি ইতিমধ্যেই অল্প বয়সে পটল তুলে ফেলেছেন ।,1,63,66
পটল,"যদুনাথ সরকার লিখছেন মুহম্মদ আকবর পটল তুলছেন এ , আপনে লিখছেন ( এবং আরো কয় জায়গায় আছে ) । বিষয়টা নিয়ে গভীর চিন্তার প্রয়োজন আছে ।",1,33,36
পটল,"ওরা যাত্রা পথে পটল তুলবে না , খামের ভেতরে রেখেছো বলে অভিমান করবে না .. .",1,15,18
পটল,"ভাইটা বুঝি তুলবে পটল নিঃশ্বাসও বয় মন্দ সে যদি যায় আমিও যাব নেই কো তাতে সন্দ । """,1,17,20
পটল,"সাইফুর রহমান মিশু লিখেন , "" শিশুর আঁকা বঙ্গবন্ধুর ছবি দেখে যার হৃদযন্ত্রের ক্রিয়া বন্ধ হবার উপক্রম হয় , তাকে গ্রাফিক নভেলের ' মুজিব'কে দেখালে নিশ্চিত পটল তুলবেন । """,1,152,155
পটল,সন্ত্রাসী সোলাইমানীর সাথে ইরাকের হেজবুল্লাহ প্রধান পটল তুলেছে একই গাড়ীতে ।,1,51,54
পটল,যেখানে ড্যানির ভাই ভিসেরিস পটল তুললে ড্যানির আগুন থেকে বেঁচে যাওয়াটা ছিল জাস্ট এ মিরাকল !,1,27,30
পটল,তবে আর কিছুক্ষণ থাকলে যে আমার বত্রিশটা দাঁত পটল তুলবে এই বিষয়ে নিশ্চিত ছিলাম ।,1,44,47
পটল,গায়েন হলো সেই যে পটল তুল্লেউ লোকে তার গান গায় । শুধু রেকর্ড শোনে না । গায় ।,1,18,21
পটল,পরে মিলে গেল বা একজন পটল তুলল - এমন বস্তাপচা সাজানো গল্প লিখে বা ছবি করে নির্বোধ দর্শকদের খুব হাসিয়ে - কাঁদিয়ে ঐ গল্পের মধ্যে involve করিয়ে দিলাম ।,1,21,24
পটল,"স্বল্পবাক্যব্যয়ে , সম্পূর্ণ বিনা চিকিৎসায় পটল ( এডস্ রোগে মারা গেলে তাকে পটল তোলাই বলা হয় ) তুলবেন আপনি ।",1,44,47
পটল,"মোদ্দা কথা , এই যে রবীন্দ্র হাবরানি দেখি সিনেমায় - টক শো তে - ফেসবুকে এটা মাইরি চারপাশে কথাও দেখিনি । ইস্কুলেও রোবিন্দ্রোজোযেইন্তীর কয়েকদিন রিহার্সাল মিটে গ্যালো । কোনো বাংলা টিচার ঢুলু ঢুলু নেত্রে রবীন্দ্র বিহ্লেষণ করছেন মনে পরেনা । বরং আমরা রবীন্দ্র নৃত্যকে পটল তোলো - ঝোলায় ভরো বলতুম । নেট জগতে একটা সারা বছর ব্যাপী রবীন্দ্র হাহাকার চলে । ওদ্ভূউত ! !",1,262,265
পটল,"পিপীলিকার পাখা মরিবার তরে গজাতে পারে তাই বলে এমনটা ভাববার কোন কারণ নাই যে , আজকের নির্বাচনের পাখাও গজিয়েছে গণতন্ত্রের পটল তোলা কর্ম সারবার জন্যে ।",1,119,122
পটল,যদিও এয়ারপোর্টে যেয়ে মনে হচ্ছিল এই নামে মনে হয় কোন কোম্পানি নেই । র থাকলেও সেটা কয়েকদিন আগে পটল তুলেছে ।,1,96,99
পটল,"হঠাৎ কেউ এসে আপনাকে গাড়ি চাপা দিল আর আপনি পটল তুললেন , এটা কেন ওই চিকিৎসা-গবেষণার মৃত্যুহারে মাপা হবে ?",1,43,46
পটল,"এই বাস্তবতায় বলতেই হয় , বিএনপি দলটি যদি উল্লিখিত কাজগুলো না করার ফলে পটল তোলার দিকে যায় , তবে সংসদীয় গণতন্ত্র বিরোধী দল প্রশ্নে অতীত দিনগুলোর মতো সমস্যার মধ্যেই থাকবে ।",1,71,74
পটল,আর কাইবার্ন এর পটল তোলাটা আমাকে ভিক্টর ফ্রাংকেনস্টাইনকে মনে করিয়ে দিয়েছে ।,1,15,18
পটল,"- বাণীদাতার নিকট কেউ মারা গেলে আমরা তার ফেইসবুকের ওয়ালে গিয়া বলবো "" ওহে অমুক , তোমার তমুক নাকি পটল তুলেছে । """,1,97,100
পটল,মেয়েদের মন নিয়ে হাজার হাজার গবেষক গবেষণা করতে করতে পটল তুলেছে তবুও কোন কোল কিনারা পায় নি ।,1,53,56
পটল,"পাকিস্থানী সামরিক বাহিনীর সেই অফিসার হচ্ছে শিরো ইচির ভাই ব্রাদার , অনেকেই শান্তিতে পটল তুলতে পেরেছে ।",1,83,86
পটল,বৃটিশ আমলে সাপের কামড়ে বেশ কিছু সাদা চামড়া পটল তুলছিলো ।,1,45,48
পটল,বিবির সাহেব অনেক আগেই পটল তোলেন চাঁটগায়ে -- সেই ঘটনার একটু মোটেই তার লাগে নি ছাঁট গায়ে !,1,22,25
পটল,"কখনও দেখেছেন , ধর্ষণ বা দুর্নীতির সাক্ষীরা একে একে পটল তুলছে , একের পর এক অ্যাক্সিডেন্ট হয়ে মরে চলেছে ?",1,51,54
পটল,ভাব এমন নিচ্ছে যেন আমি দুরারোগ্য রোগে ভুগছি আর অল্প কিছু দিনের মধ্যে পটল তুলব ।,1,69,72
পটল,ততক্ষণে আরও দুটো ব্ল্যাকবেরী আইস্ক্রিম পটল তুললো ।,1,39,42
পটল,"সালে নটিংহ্যাম এবং ডার্বি বিশ্ববিদ্যালয়ের দুই গবেষক জেমস বন্ডের টি বই পড়ে , বন্ডের ভদকা মার্টিনি পানের পরিমানের উপর ভিত্তি করে দাবী করে জেমস বন্ড একজন মদ্যপ মাতাল !! হ্যা , , লাইসেন্স টু কিল জেমস বন্ডের কথাই বলছেন দুই লেখক । থেকে সাল পর্যন্ত জেমস বন্ডের বই পর্যালোচনা করে তারা আবিষ্কার করেন বন্ড প্রতি সপ্তাহে প্রায় লিটারের ( ইউনিট ) মদ খেয়ে চলেছে । এই হারে মদ খাওয়া চালাতে থাকলে অল্প বয়সেই পটল তোলার সম্ভবনা আছে । তাছাড়া মাতাল অবস্থায় জেমস বন্ড প্রায় গাড়ি চালায় , গোলাগুলি করে যা জনসাধারনের জন্যও বেশ বিপজ্জনক । লেখকদ্বয় দাবী করেন , "" আন্তর্জাতিক সন্ত্রাসী , জুয়াড়ীদের সাথে নিয়মিত কাজ করলে সামাজিক চাপের কারনে মদ খাওয়া বেড়ে যেতেই পারে , আমরা এসব বুঝি । তবে জেমস বন্ডের উচিৎ অতি দ্রুত তার মদ খাওয়ার অভ্যাসের ব্যপারে ডাক্তারের সাথে যোগাযোগ করা । """,1,397,400
পটল,"আলু , রাঙাআলু , কুমড়ো , পটল , ঝিঙে , মুলো সব ডুমো করে কাটা হবে ।",0,25,28
পটল,"এছাড়া পটল , ঝিঙা , কাঁকরোল , লাউ , চিচিঙ্গা , বেগুনের দাম সপ্তাহের ব্যবধানে অপরিবর্তিত রয়েছে ।",0,7,10
পটল,পটল বিক্রি করেই সংসারের খরচ চালাতাম ।,0,0,3
পটল,"বামনটারির সত্য সরকার , হরিপদ সরকারের অভিযোগ , ধূপগুড়ির বাজারে ঝিঙে টাকা , পটল টাকা , কাকরোল টাকা কেজি দরে চাষিদের থেকে কিনছে ফড়েরা ।",0,75,78
পটল,"ওতে হেলেঞ্চা শাক , পালং শাক , উচ্ছে , পটল , আলু , মূলো , কচু , কুমড়ো সব কিছুই দিও যাতে পল্টু সব রকমের ভিটামিনই পায় ।",0,38,41
পটল,"লতি দিয়ে ইলিশ মাছ , কবুতরের বাচ্চা , পটল ভাজা , গরুর ভুনা আর তিন পদের ভর্তা ।",0,38,41
পটল,"এক পাকে দেখে নিলাম পটল খেত , আখ , পাট আর করলা চাষ ।",0,19,22
পটল,"পটল , টি ( খোসা ছাড়ানো , দানা ফেলা ) পেঁয়াজ কুচি / কাপ কাঁচামরিচ , টি কুচি করা ধনেপাতা কুচি করা চা-চামচ সরিষার তেল প্রয়োজন মতো ( সয়াবিন তেলও নিতে পারেন ) লবন স্বাদমতো",0,0,3
পটল,"তাঁর স্বামী ধরণী মণ্ডল বলেন , "" গ্রীষ্মে জমিতেই পুড়ে নিঃশেষ হয়ে গিয়েছে পাট , করলা , পটল ও তিলের চাষ ।",0,87,90
পটল,"বাজারের ঠিক মাঝবরারই একটি তক্তপোষের উপর কয়েকটা ঝুড়িতে আলু , পটল , লঙ্কা ও সব্জি নিয়ে চন্দনবাবুর দোকান ।",0,62,65
পটল,আজকের দিনের পরিত্যাজ্য খাদ্য : শেষ রাত : : পর্যন্ত পটল পরে মূলা খাওয়া নিষেধ ।,0,51,54
পটল,"ঝাঁকা ভর্তি সিম , করলা , বেগুন , পটল , কাঁচামরিচ দেখে বোঝার উপায় নেই সবজির সরবরাহ সঙ্কট রয়েছে রাজধানীর কাঁচাবাজারে ।",0,33,36
পটল,"সুরভি হাই তুলে বলল , পটল খেতে ইচ্ছে না করলে শুধু মাছ দিয়ে খাও ।",0,21,24
পটল,"বেগুন , টমেটো , পটল , ঝিঙা , বরবটি ও অন্যান্য সবজি কিনতে হচ্ছে - টাকা কেজিতে ।",0,16,19
পটল,তবে পটল ফালি না করে আস্ত রাখুন এবং ভেতরের সব কিছু ফেলে দিন ।,0,4,7
পটল,পানি নিকাশ পটল জলাবদ্ধতা সহ্য করতে পারে না ।,0,11,14
পটল,"তবে ঢ্যাঁড়শ , পটল , ঝিঙের মতো কোনও কোনও সব্জির দাম গত জুনের তুলনায় এই জুনে কম বলে দাবি করেছেন মন্ত্রী ।",0,15,18
পটল,নিয়মিত পটল খেলে রক্ত পরিষ্কার থাকে ।,0,8,11
পটল,"দেখতেও ছিল সুন্দরী পটল চেরা চোখ , ঘন কালো চুল যেমন রূপে রূপবতী ।",0,19,22
পটল,"ভর্তা , ভাজি , মাছ এবং সেই সঙ্গে বিভিন্ন সবজির সঙ্গেও রান্না করে খাওয়া হয় পটল ।",0,76,79
পটল,পটল ভারতে খুব জনপ্রিয় একটি সবজি ।,0,0,3
পটল,"শরীর সেই হাঁড়ি , মনবুদ্ধি জল , ইন্দ্রিয়ের বিষয়গুলি ডাল , ভাত , আলু , পটল , স্ত্রী , পুত্র , পরিবার ।",0,72,75
পটল,পটল চাষিদের জন্য একটি বড় সমস্যা ক্ষেতে মাছি পোকার আক্রমন ।,0,0,3
পটল,"পদ্ধতি : আলু , করলা , বরবটি , পটল , বেগুন , ফুলকপি , মিষ্টিকুমড়া , বাঁধাকপি , শিম কেটে নিয়ে ধুয়ে নিতে হবে ।",0,30,33
পটল,"কিন্ত পটল , কুমড়ো তো মাটির সঙ্গে লেপ্টে থাকে ।",0,6,9
পটল,"এর বাইরে করলা থেকে টাকা কেজি , ঢেঁড়স থেকে টাকা , পটল থেকে টাকা , মুলা থেকে টাকা হালি , কাঁচা মরিচ থেকে টাকা কেজি বিক্রি হচ্ছে ।",0,50,53
পটল,"লাউ , কুমড়া , ঝিন্তা , পটল ইত্যাদি সবজি হিসেবে খাওয়া হলেও প্রকৃতপক্ষে এগুলাে সবই ফল ।",0,24,27
পটল,কিঞ্চিৎ আলু পটল চাষ করতো মনে হয় ।,0,12,15
পটল,"সপ্তাহের ব্যবধানে জেলার বাজারগুলোতে পটল , বেগুন , শিম , ধুন্দল , বরবটি , ঢেঁড়স , লাউ , টমেটোসহ প্রায় সব ধরনের সবজির দাম বেড়েছে ।",0,36,39
পটল,"পটল , বেগুন , শষা , ঢেড়স , কুমড়া ক্ষেতের পোকামাকড় দমনে ফেরমন ট্র্র্যাপ দারুনভাবে কাজ করছে ।",0,0,3
